Sheet: Personnage
A1: Classe | B1: Niveau | D1: NGE | E1: of:=NIV_CLASSE1+NIV_CLASSE2+IF(NIV_CLASSE2>0;-1;0) -> 12 | G1: PV totaux | H1: of:=SUM([Personnage.K2:.AD2])+CON*(NIV_CLASSE1+NIV_CLASSE2+NIV_CLASSE3) -> 65 | J1: Jet au niveau | K1: 1 (jet max) | L1: 2 | M1: 3 | N1: 4 | O1: 5 | P1: 6 | Q1: 7 | R1: 8 | S1: 9 | T1: 10 | U1: 11 | V1: 12 | W1: 13 | X1: 14 | Y1: 15 | Z1: 16 | AA1: 17 | AB1: 18 | AC1: 19 | AD1: 20
A2: Druide | B2: 6 | D2: NLS | E2: of:=NIV_CLASSE3 -> 0 | F2: DÃ©gÃ¢ts --> | J2: Score au dÃ© | K2: 8 | L2: 6 | M2: 2 | N2: 1 | O2: 6 | P2: 1 | Q2: 7 | R2: 5 | S2: 5 | T2: 2 | U2: 4 | V2: 3 | W2: 2
A3: S. des MarÃ©es | B3: 7
B4: 0 | J4: Bonus de taille | K4: of:=IF([Personnage.$K$5]="P";1;0)+IF([Personnage.$K$5]="TP";2;0)+IF([Personnage.$K$5]="Min";3;0)+IF([Personnage.$K$5]="I";4;0)+IF([Personnage.$K$5]="G";-1;0)+IF([Personnage.$K$5]="TG";-2;0)+IF([Personnage.$K$5]="Gig";-3;0)+IF([Personnage.$K$5]="C";-4;0) -> 0
J5: Taille avec FA | K5: of:=IF(FA;[$'Formes animales'.B12];[$Personnage.B10]) -> M
A6: PrÃ©nom | B6: Aeshar | C6: Nom | D6: FaronwiÃ«ar
A7: Alignement | B7: Neutre strict | C7: Joueur | D7: Robin
A8: Age | B8: 100 | C8: Tranche d'age | D8: Jeune adulte
A9: DivinitÃ© | B9: La nature | C9: XP | D9: of:=80139+375 -> 80514
A10: CatÃ©gorie de taille | B10: M | C10: Race | D10: Elfe dÃ©sertique
A11: Taille | B11: 1m50 | C11: Poids | D11: 50kg
G12: Statut | H12: of:=IF([Personnage.H13]<=-10;"MORT";IF((SUM([Personnage.G2:.H11])+[Personnage.H14])>PV;"ASSOME";"-")) -> -
B13: CalculÃ©e (m) | C13: CalculÃ©e (cases) | D13: Racial (m) | E13: Bonus/malus (m) | G13: PV restants | H13: of:=[Personnage.H1]-SUM([Personnage.G2:.H11]) -> 65
A14: Vitesse | B14: of:=VITESSE_REDUC -> 9 | C14: of:=ROUND(VITESSE/1.5;0) -> 6 | D14: of:=IF(FA;[$'Formes animales'.B11];9) -> 9 | G14: DÃ©gÃ¢ts non-lÃ©taux | H14: 0
A15: Initiative | B15: of:=[Personnage.C19] -> 2 | D15: avec FA | G15: Niveaux nÃ©gatifs | H15: 0
B17: Total | C17: Modificateur | D17: Base | E17: Racial | F17: AltÃ©ration | G17: Alt. avec FA. | H17: Temporaire | I17: Origine
A18: Force | B18: of:=IF(FA;[$'Formes animales'.B6]+SUM([$Personnage.G18:.H18]);SUM([Personnage.D18:.H18])) -> 13 | C18: of:=IF(([Personnage.B18]-10)/2>0;ROUNDDOWN(([Personnage.B18]-10)/2;0);ROUNDUP(([Personnage.B18]-10)/2;0)) -> 1 | D18: 13 | E18: -2 | G18: 2
A19: DextÃ©ritÃ© | B19: of:=IF(FA;[$'Formes animales'.B7]+SUM([$Personnage.G19:.H19]);SUM([Personnage.D19:.H19])) -> 14 | C19: of:=IF(([Personnage.B19]-10)/2>0;ROUNDDOWN(([Personnage.B19]-10)/2;0);ROUNDUP(([Personnage.B19]-10)/2;0)) -> 2 | D19: 12 | E19: 2
A20: Constitution | B20: of:=IF(FA;[$'Formes animales'.B8]+SUM([$Personnage.G20:.H20]);SUM([Personnage.D20:.H20])) -> 12 | C20: of:=IF(([Personnage.B20]-10)/2>0;ROUNDDOWN(([Personnage.B20]-10)/2;0);ROUNDUP(([Personnage.B20]-10)/2;0)) -> 1 | D20: 10 | E20: 0 | G20: 2
A21: Intelligence | B21: of:=IF(FA;SUM([Personnage.D21:.E21])+SUM([$Personnage.G21:.H21]);SUM([Personnage.D21:.H21])) -> 16 | C21: of:=IF(([Personnage.B21]-10)/2>0;ROUNDDOWN(([Personnage.B21]-10)/2;0);ROUNDUP(([Personnage.B21]-10)/2;0)) -> 3 | D21: 16 | E21: 0
A22: Sagesse | B22: of:=IF(FA;SUM([Personnage.D22:.E22])+SUM([$Personnage.G22:.H22]);SUM([Personnage.D22:.H22])) -> 23 | C22: of:=IF(([Personnage.B22]-10)/2>0;ROUNDDOWN(([Personnage.B22]-10)/2;0);ROUNDUP(([Personnage.B22]-10)/2;0)) -> 6 | D22: 19 | E22: 0 | F22: 4
A23: Charisme | B23: of:=IF(FA;SUM([Personnage.D23:.E23])+SUM([$Personnage.G23:.H23]);SUM([Personnage.D23:.H23])) -> 8 | C23: of:=IF(([Personnage.B23]-10)/2>0;ROUNDDOWN(([Personnage.B23]-10)/2;0);ROUNDUP(([Personnage.B23]-10)/2;0)) -> -1 | D23: 8 | E23: 0
A25: BBA | B25: of:=ROUNDDOWN(NIV_CLASSE1*3/4;0)+ROUNDDOWN(NIV_CLASSE2*3/4;0) -> 9
A26: Lutte | B26: of:=BBA+FOR-TAILLE*4 -> 10
A27: Contact Ã distance | B27: of:=BBA+DEX+TAILLE -> 11
A29: Forme animale | B29: 0 | C29: sur | D29: 2 | E29: Forme animale : | G29: of:=FORME_ANIMALE -> GuÃ©pard | H29: of:=FALSE() -> 0 | I29: Soigne (PV) | J29: of:=NGE+CON -> 13 | K29: DurÃ©e (h) | L29: of:=NIV_CLASSE1 -> 6
A30: Invocation d'Ã©lementaire | B30: 0 | C30: sur | D30: 1
A31: Dessication de corps | B31: 0 | C31: sur | D31: of:=IF(NIV_CLASSE2<10;3;4) -> 3
A33: Arme | B33: Attaque | C33: DÃ© | D33: Modif. dÃ©gÃ¢ts | E33: Critique | F33: F. de portÃ©e | G33: Type | H33: A. Magique + | I33: A. de maÃ®tre | J33: DÃ©tails
A34: Attaque Forme animale | B34: of:=BBA+FOR+TAILLE+[Personnage.H34]+IF([Personnage.H34]=0;IF([Personnage.I34]="Oui";1;0);0) -> 10 | C34: - | D34: of:=FOR+[Personnage.H34] -> 1 | E34: - | F34: - | G34: - | H34: 0 | I34: Non
A35: Cimeterre +1 | B35: of:=BBA+FOR+TAILLE+[Personnage.H35]+IF([Personnage.H35]=0;IF([Personnage.I35]="Oui";1;0);0) -> 11 | C35: 1D6 | D35: of:=FOR+[Personnage.H35] -> 2 | E35: 18-20x2 | F35: - | G35: Tranchant | H35: 1 | I35: Oui
A36: Arc court composite | B36: of:=BBA+FOR+TAILLE+[Personnage.H36]+IF([Personnage.H36]=0;IF([Personnage.I36]="Oui";1;0);0) -> 10 | C36: 1D6 | D36: of:=FOR+[Personnage.H36] -> 1 | E36: 20x3 | F36: 18m | G36: Contondant | H36: 0 | I36: Non
B38: Total | C38: Armure | D38: Bouclier | E38: DextÃ©ritÃ© | F38: Taille | G38: Naturelle | H38: Parade | I38: Chance | J38: Esquive | K38: CA avec FA | L38: Temporaire | M38: Origine
A39: CA | B39: of:=10+IF(FA;SUM([Personnage.E39:.G39])+[Personnage.K39];SUM([Personnage.C39:.J39]))+[Personnage.L39]+IF(DEF_TOTALE=1;4+IF([$CompÃ©tences.O2]>=5;2;0);0) -> 20 | C39: 6 | D39: 2 | E39: of:=IF(DEX_MAX<>"-";IF(DEX<DEX_MAX;DEX;DEX_MAX);DEX) -> 2 | F39: of:=TAILLE -> 0 | G39: of:=IF(FA;[$'Formes animales'.B13];0) -> 0 | H39: 0 | I39: 0 | J39: 0 | K39: 0 | L39: 0
A40: Contact | B40: of:=10+[Personnage.E39]+[Personnage.F39]+IF(FA;[Personnage.K39];[Personnage.H39]+[Personnage.I39]+[Personnage.J39])+[Personnage.L39]+IF(DEF_TOTALE=1;4+IF([$CompÃ©tences.O2]>=5;2;0);0) -> 12 | C40: DÃ©fense totale pour ce tour | E40: of:=FALSE() -> 0
A41: Pris au dÃ©pourvu | B41: of:=10+IF(FA;[Personnage.G39]+[Personnage.F39]+[Personnage.K39];SUM([Personnage.C39:.D39])+SUM([Personnage.F39:.I39]))+[Personnage.L39]+IF(DEX<=0;DEX;0)+IF(DEF_TOTALE=1;4+IF([$CompÃ©tences.O2]>=5;2;0);0) -> 18
B43: Total | C43: Base | D43: CaractÃ©ristique | E43: RÃ©sistance | F43: Racial | G43: Moral | H43: Divers | I43: Temporaire | J43: Origine
A44: RÃ©flexes | B44: of:=SUM([Personnage.C44:.I44]) -> 6 | C44: of:=ROUNDDOWN(NIV_CLASSE1/3;0)+ROUNDDOWN(NIV_CLASSE2/3;0) -> 4 | D44: of:=[Personnage.C19] -> 2
A45: Vigueur | B45: of:=SUM([Personnage.C45:.I45]) -> 11 | C45: of:=ROUNDDOWN(NIV_CLASSE1/2+2;0)+ROUNDDOWN(NIV_CLASSE2/2+2;0) -> 10 | D45: of:=[Personnage.C20] -> 1
A46: VolontÃ© | B46: of:=SUM([Personnage.C46:.I46]) -> 16 | C46: of:=ROUNDDOWN(NIV_CLASSE1/2+2;0)+ROUNDDOWN(NIV_CLASSE2/2+2;0) -> 10 | D46: of:=[Personnage.C22] -> 6 | J46: +2 vs Enchantements, +4 contre les effets mentaux
A49: Sorts | B49: Carac. Magie | C49: of:=SAG -> 6
A50: Niveau | B50: Par jour | C50: Base | D50: Bonus
A51: 0 | B51: of:=SUM([Personnage.C51:.D51]) -> 6 | C51: 6 | D51: 0
A52: 1 | B52: of:=SUM([Personnage.C52:.D52]) -> 7 | C52: 5 | D52: of:=IF([Personnage.A52]>0;IF(ROUNDUP((MAGIE+1-[Personnage.A52])/4;0)>0;ROUNDUP((MAGIE+1-[Personnage.A52])/4;0);0);0) -> 2
A53: 2 | B53: of:=SUM([Personnage.C53:.D53]) -> 7 | C53: 5 | D53: of:=IF([Personnage.A53]>0;IF(ROUNDUP((MAGIE+1-[Personnage.A53])/4;0)>0;ROUNDUP((MAGIE+1-[Personnage.A53])/4;0);0);0) -> 2
A54: 3 | B54: of:=SUM([Personnage.C54:.D54]) -> 6 | C54: 5 | D54: of:=IF([Personnage.A54]>0;IF(ROUNDUP((MAGIE+1-[Personnage.A54])/4;0)>0;ROUNDUP((MAGIE+1-[Personnage.A54])/4;0);0);0) -> 1
A55: 4 | B55: of:=SUM([Personnage.C55:.D55]) -> 4 | C55: 3 | D55: of:=IF([Personnage.A55]>0;IF(ROUNDUP((MAGIE+1-[Personnage.A55])/4;0)>0;ROUNDUP((MAGIE+1-[Personnage.A55])/4;0);0);0) -> 1
A56: 5 | B56: of:=SUM([Personnage.C56:.D56]) -> 4 | C56: 3 | D56: of:=IF([Personnage.A56]>0;IF(ROUNDUP((MAGIE+1-[Personnage.A56])/4;0)>0;ROUNDUP((MAGIE+1-[Personnage.A56])/4;0);0);0) -> 1
A57: 6 | B57: of:=SUM([Personnage.C57:.D57]) -> 3 | C57: 2 | D57: of:=IF([Personnage.A57]>0;IF(ROUNDUP((MAGIE+1-[Personnage.A57])/4;0)>0;ROUNDUP((MAGIE+1-[Personnage.A57])/4;0);0);0) -> 1
A58: 7 | B58: of:=SUM([Personnage.C58:.D58]) -> 0 | D58: of:=IF([Personnage.A58]>0;IF(ROUNDUP((MAGIE+1-[Personnage.A58])/4;0)>0;ROUNDUP((MAGIE+1-[Personnage.A58])/4;0);0);0) -> 0
A59: 8 | B59: of:=SUM([Personnage.C59:.D59]) -> 0 | D59: of:=IF([Personnage.A59]>0;IF(ROUNDUP((MAGIE+1-[Personnage.A59])/4;0)>0;ROUNDUP((MAGIE+1-[Personnage.A59])/4;0);0);0) -> 0
A60: 9 | B60: of:=SUM([Personnage.C60:.D60]) -> 0 | D60: of:=IF([Personnage.A60]>0;IF(ROUNDUP((MAGIE+1-[Personnage.A60])/4;0)>0;ROUNDUP((MAGIE+1-[Personnage.A60])/4;0);0);0) -> 0
A62: Aptitudes de classe | B62: Origine | C62: Description
A63: Compagnon animal | B63: Druide 1
A64: Empathie sauvage | B64: Druide 1 | C64: Permet de faire de la diplomatie avec les animaux sir un jet de 1D20 + | H64: of:=NIV_CLASSE1+CHA -> 5
A65: Instinct naturel | B65: Druide 1 | C65: +2 Connaissance (nature)et Survie
A66: Sandskimmer | B66: Druide 2 | C66: Pas de malus dans le sable normal, traite le sable mouvant comme du sable normal
A67: Absence de traces | B67: Druide 3 | C67: Ne laisse pas de traces s'il le souhaite
A68: Endurance Ã la chaleur | B68: Druide 4 | C68: +2 contres les effets de feu et de chaleur
A69: Forme animale | B69: Druide 5,6 | C69: Peut se transformer 2/j en animal avec un maximum de 6DV de taille P ou M
A70: Localiser eau potable | B70: SdM 1 | C70: Comme le sort, plus la taille et la distance de l'eau dans les corps et si l'eau est potable. Si non potable, en connait les raisons. Action complexe pour lancer, puis dure 10 min.
A71: Endurance Ã la chaleur Sup. | B71: SdM 1 | C71: RÃ©sistance au feu (5), supporte trÃ¨s bien la chaleur
A72: Dessication de corps | B72: SdM 2,4,7 | C72: 3/j : Ã 9m, Vigueur DD : | E72: of:=10+NIV_CLASSE2+SAG -> 23 | F72: ou inflige : | G72: of:=NIV_CLASSE2 -> 7 | H72: D8 dÃ©gÃ¢ts de dessication et fatigue jusqu'Ã ce que la crÃ©ature boive 1/4 de son poids en eau. Si tuÃ©e, anime un mephit d'eau aprÃ¨s un round et dure : | S72: of:=NIV_CLASSE2 -> 7 | T72: min
A73: Vitesse augmentÃ©e | B73: SdM 3 | C73: Augmente la vitesse de 1,5m sur de la terre ou du sable
A74: Invocation d'Ã©lÃ©mentaire | B74: SdM 6 | C74: Invoque un Ã©lÃ©mentaire de sous type eau de taille G (1/j). Le NLS est de : | H74: of:=10+NIV_CLASSE2 -> 17
A79: Dons | B79: Origine | C79: Description
A80: Vestige | B80: NGE 1 | C80: Peut se lier Ã des lieux
A81: Incantation animale | B81: NGE 3 | C81: Peut lancer des sorts sous forme animale
A82: Pistage | B82: NGE 6 | C82: Peut pister avec la Survie
A83: Lien naturel | B83: NGE 9 | C83: AmÃ©liore le niveau de Druide de +3 pour les calculs du compagnon animal (Ã concurrence du NGE)
A84: Concentration du scorpion | B84: NGE 12 | C84: +4 contre les effets mentaux
A91: Racial | B91: Description
A92: ImmunitÃ© elfique | B92: ImmunitÃ© aux effets de sommeil, mÃ©dite 4h par nuit
A93: RÃ©sistance aux enchant. | B93: +2 vs Enchantements
A94: Maniement des armes | B94: Cimeterre, rapiÃ¨re et arc court (et court composite)
A95: Amis des animaux | B95: +2 Dressage et Equitation
A96: Endurance Ã la chaleur (elfe) | B96: +4 contre les effets de la chaleur
A97: Åil de lynx | B97: +2 en DÃ©tection
A98: Vision nocturne
A100: Langues | B100: Origine
A101: Commun | B101: Racial
A102: Langue des druides | B102: Druide 1
A103: Elfique | B103: Efle
B104: INT +1
B105: INT +2
B106: INT +3
A108: SpÃ©cial | B108: Description

Sheet: CompÃ©tences
A1: CompÃ©tences Roublard | B1: Total | C1: Classe 1 | D1: DegrÃ© | E1: Classe 2 | F1: DegrÃ© | G1: Classe 3 | H1: DegrÃ© | I1: Carac. | J1: Entrai. | K1: Racial | L1: Autres | M1: Synergie | N1: Malus enc. | O1: Deg. effectif | P1: Autres synergies
A2: Acrobaties | B2: of:=[CompÃ©tences.O2]+IF([CompÃ©tences.N2]<>"-";[CompÃ©tences.N2];0)+[CompÃ©tences.L2]+IF(FA;[$'Formes animales'.B15];[$CompÃ©tences.K2])+[CompÃ©tences.I2]+IF([CompÃ©tences.M2]<>"-";[CompÃ©tences.M2];0) -> 2 | C2: HC | E2: HC | G2: HC | I2: of:=DEX -> 2 | M2: of:=IF([CompÃ©tences.O44]>=5;2;0) -> 0 | N2: of:=MALUS_TESTS -> 0 | O2: of:=[CompÃ©tences.D2]+[CompÃ©tences.F2]+[CompÃ©tences.H2]+[CompÃ©tences.J2] -> 0 | P2: of:=IF([CompÃ©tences.O2]>=5;"La dÃ©fense totale passe Ã  +6";"Pas encore") -> Pas encore
A3: Art de la magie | B3: of:=[CompÃ©tences.O3]+IF([CompÃ©tences.N3]<>"-";[CompÃ©tences.N3];0)+[CompÃ©tences.L3]+IF(FA;[$'Formes animales'.B16];[$CompÃ©tences.K3])+[CompÃ©tences.I3]+IF([CompÃ©tences.M3]<>"-";[CompÃ©tences.M3];0) -> 5 | C3: Druide | D3: 1 | E3: HC | G3: HC | I3: of:=INT -> 3 | J3: 1 | M3: of:=IF([CompÃ©tences.O12]>=5;2;0) -> 0 | N3: - | O3: of:=[CompÃ©tences.D3]+[CompÃ©tences.F3]+[CompÃ©tences.H3]+[CompÃ©tences.J3] -> 2
A4: Artisanat (...) | B4: of:=[CompÃ©tences.O4]+IF([CompÃ©tences.N4]<>"-";[CompÃ©tences.N4];0)+[CompÃ©tences.L4]+IF(FA;[$'Formes animales'.B17];[$CompÃ©tences.K4])+[CompÃ©tences.I4]+IF([CompÃ©tences.M4]<>"-";[CompÃ©tences.M4];0) -> 16 | C4: Druide | D4: 8 | E4: S. des MarÃ©es | F4: 5 | G4: HC | I4: of:=INT -> 3 | M4: - | N4: - | O4: of:=[CompÃ©tences.D4]+[CompÃ©tences.F4]+[CompÃ©tences.H4]+[CompÃ©tences.J4] -> 13
A5: Bluff | B5: of:=[CompÃ©tences.O5]+IF([CompÃ©tences.N5]<>"-";[CompÃ©tences.N5];0)+[CompÃ©tences.L5]+IF(FA;[$'Formes animales'.B18];[$CompÃ©tences.K5])+[CompÃ©tences.I5]+IF([CompÃ©tences.M5]<>"-";[CompÃ©tences.M5];0) -> -1 | C5: HC | E5: HC | G5: HC | I5: of:=CHA -> -1 | M5: - | N5: - | O5: of:=[CompÃ©tences.D5]+[CompÃ©tences.F5]+[CompÃ©tences.H5]+[CompÃ©tences.J5] -> 0
A6: Concentration | B6: of:=[CompÃ©tences.O6]+IF([CompÃ©tences.N6]<>"-";[CompÃ©tences.N6];0)+[CompÃ©tences.L6]+IF(FA;[$'Formes animales'.B19];[$CompÃ©tences.K6])+[CompÃ©tences.I6]+IF([CompÃ©tences.M6]<>"-";[CompÃ©tences.M6];0) -> 16 | C6: Druide | D6: 8 | E6: S. des MarÃ©es | F6: 7 | G6: HC | I6: of:=CON -> 1 | M6: - | N6: - | O6: of:=[CompÃ©tences.D6]+[CompÃ©tences.F6]+[CompÃ©tences.H6]+[CompÃ©tences.J6] -> 15
A7: Connaissances (archit./ingÃ©nÃ©rie) | B7: of:=[CompÃ©tences.O7]+IF([CompÃ©tences.N7]<>"-";[CompÃ©tences.N7];0)+[CompÃ©tences.L7]+IF(FA;[$'Formes animales'.B20];[$CompÃ©tences.K7])+[CompÃ©tences.I7]+IF([CompÃ©tences.M7]<>"-";[CompÃ©tences.M7];0) -> 3 | C7: HC | E7: HC | G7: HC | I7: of:=INT -> 3 | M7: - | N7: - | O7: of:=[CompÃ©tences.D7]+[CompÃ©tences.F7]+[CompÃ©tences.H7]+[CompÃ©tences.J7] -> 0
A8: Connaissances (explo. souterraine) | B8: of:=[CompÃ©tences.O8]+IF([CompÃ©tences.N8]<>"-";[CompÃ©tences.N8];0)+[CompÃ©tences.L8]+IF(FA;[$'Formes animales'.B21];[$CompÃ©tences.K8])+[CompÃ©tences.I8]+IF([CompÃ©tences.M8]<>"-";[CompÃ©tences.M8];0) -> 3 | C8: HC | E8: HC | G8: HC | I8: of:=INT -> 3 | M8: - | N8: - | O8: of:=[CompÃ©tences.D8]+[CompÃ©tences.F8]+[CompÃ©tences.H8]+[CompÃ©tences.J8] -> 0
A9: Connaissances (folklore local) | B9: of:=[CompÃ©tences.O9]+IF([CompÃ©tences.N9]<>"-";[CompÃ©tences.N9];0)+[CompÃ©tences.L9]+IF(FA;[$'Formes animales'.B22];[$CompÃ©tences.K9])+[CompÃ©tences.I9]+IF([CompÃ©tences.M9]<>"-";[CompÃ©tences.M9];0) -> 3 | C9: HC | E9: HC | G9: HC | I9: of:=INT -> 3 | M9: - | N9: - | O9: of:=[CompÃ©tences.D9]+[CompÃ©tences.F9]+[CompÃ©tences.H9]+[CompÃ©tences.J9] -> 0
A10: Connaissances (gÃ©ographie) | B10: of:=[CompÃ©tences.O10]+IF([CompÃ©tences.N10]<>"-";[CompÃ©tences.N10];0)+[CompÃ©tences.L10]+IF(FA;[$'Formes animales'.B23];[$CompÃ©tences.K10])+[CompÃ©tences.I10]+IF([CompÃ©tences.M10]<>"-";[CompÃ©tences.M10];0) -> 4 | C10: HC | E10: S. des MarÃ©es | F10: 1 | G10: HC | I10: of:=INT -> 3 | M10: - | N10: - | O10: of:=[CompÃ©tences.D10]+[CompÃ©tences.F10]+[CompÃ©tences.H10]+[CompÃ©tences.J10] -> 1
A11: Connaissances (histoire) | B11: of:=[CompÃ©tences.O11]+IF([CompÃ©tences.N11]<>"-";[CompÃ©tences.N11];0)+[CompÃ©tences.L11]+IF(FA;[$'Formes animales'.B24];[$CompÃ©tences.K11])+[CompÃ©tences.I11]+IF([CompÃ©tences.M11]<>"-";[CompÃ©tences.M11];0) -> 3 | C11: HC | E11: HC | G11: HC | I11: of:=INT -> 3 | M11: - | N11: - | O11: of:=[CompÃ©tences.D11]+[CompÃ©tences.F11]+[CompÃ©tences.H11]+[CompÃ©tences.J11] -> 0
A12: Connaissances (mystÃ¨res) | B12: of:=[CompÃ©tences.O12]+IF([CompÃ©tences.N12]<>"-";[CompÃ©tences.N12];0)+[CompÃ©tences.L12]+IF(FA;[$'Formes animales'.B25];[$CompÃ©tences.K12])+[CompÃ©tences.I12]+IF([CompÃ©tences.M12]<>"-";[CompÃ©tences.M12];0) -> 3 | C12: HC | E12: HC | G12: HC | I12: of:=INT -> 3 | M12: - | N12: - | O12: of:=[CompÃ©tences.D12]+[CompÃ©tences.F12]+[CompÃ©tences.H12]+[CompÃ©tences.J12] -> 0
A13: Connaissances (nature) | B13: of:=[CompÃ©tences.O13]+IF([CompÃ©tences.N13]<>"-";[CompÃ©tences.N13];0)+[CompÃ©tences.L13]+IF(FA;[$'Formes animales'.B26];[$CompÃ©tences.K13])+[CompÃ©tences.I13]+IF([CompÃ©tences.M13]<>"-";[CompÃ©tences.M13];0) -> 18 | C13: Druide | D13: 8 | E13: S. des MarÃ©es | F13: 3 | G13: HC | I13: of:=INT -> 3 | L13: 2 | M13: of:=IF([CompÃ©tences.O45]>=5;2;0) -> 2 | N13: - | O13: of:=[CompÃ©tences.D13]+[CompÃ©tences.F13]+[CompÃ©tences.H13]+[CompÃ©tences.J13] -> 11 | P13: Instinct naturel
A14: Connaissances (noblesse et royautÃ©) | B14: of:=[CompÃ©tences.O14]+IF([CompÃ©tences.N14]<>"-";[CompÃ©tences.N14];0)+[CompÃ©tences.L14]+IF(FA;[$'Formes animales'.B27];[$CompÃ©tences.K14])+[CompÃ©tences.I14]+IF([CompÃ©tences.M14]<>"-";[CompÃ©tences.M14];0) -> 3 | C14: HC | E14: HC | G14: HC | I14: of:=INT -> 3 | M14: - | N14: - | O14: of:=[CompÃ©tences.D14]+[CompÃ©tences.F14]+[CompÃ©tences.H14]+[CompÃ©tences.J14] -> 0
A15: Connaissances (plans) | B15: of:=[CompÃ©tences.O15]+IF([CompÃ©tences.N15]<>"-";[CompÃ©tences.N15];0)+[CompÃ©tences.L15]+IF(FA;[$'Formes animales'.B28];[$CompÃ©tences.K15])+[CompÃ©tences.I15]+IF([CompÃ©tences.M15]<>"-";[CompÃ©tences.M15];0) -> 11 | C15: HC | E15: S. des MarÃ©es | F15: 8 | G15: HC | I15: of:=INT -> 3 | M15: - | N15: - | O15: of:=[CompÃ©tences.D15]+[CompÃ©tences.F15]+[CompÃ©tences.H15]+[CompÃ©tences.J15] -> 8
A16: Connaissances (religion) | B16: of:=[CompÃ©tences.O16]+IF([CompÃ©tences.N16]<>"-";[CompÃ©tences.N16];0)+[CompÃ©tences.L16]+IF(FA;[$'Formes animales'.B29];[$CompÃ©tences.K16])+[CompÃ©tences.I16]+IF([CompÃ©tences.M16]<>"-";[CompÃ©tences.M16];0) -> 3 | C16: HC | E16: HC | G16: HC | I16: of:=INT -> 3 | M16: - | N16: - | O16: of:=[CompÃ©tences.D16]+[CompÃ©tences.F16]+[CompÃ©tences.H16]+[CompÃ©tences.J16] -> 0
A17: ContrefaÃ§on | B17: of:=[CompÃ©tences.O17]+IF([CompÃ©tences.N17]<>"-";[CompÃ©tences.N17];0)+[CompÃ©tences.L17]+IF(FA;[$'Formes animales'.B30];[$CompÃ©tences.K17])+[CompÃ©tences.I17]+IF([CompÃ©tences.M17]<>"-";[CompÃ©tences.M17];0) -> 3 | C17: HC | E17: HC | G17: HC | I17: of:=INT -> 3 | M17: - | N17: - | O17: of:=[CompÃ©tences.D17]+[CompÃ©tences.F17]+[CompÃ©tences.H17]+[CompÃ©tences.J17] -> 0
A18: Crochetage | B18: of:=[CompÃ©tences.O18]+IF([CompÃ©tences.N18]<>"-";[CompÃ©tences.N18];0)+[CompÃ©tences.L18]+IF(FA;[$'Formes animales'.B31];[$CompÃ©tences.K18])+[CompÃ©tences.I18]+IF([CompÃ©tences.M18]<>"-";[CompÃ©tences.M18];0) -> 2 | C18: HC | E18: HC | G18: HC | I18: of:=DEX -> 2 | M18: - | N18: - | O18: of:=[CompÃ©tences.D18]+[CompÃ©tences.F18]+[CompÃ©tences.H18]+[CompÃ©tences.J18] -> 0
A19: DÃ©cryptage | B19: of:=[CompÃ©tences.O19]+IF([CompÃ©tences.N19]<>"-";[CompÃ©tences.N19];0)+[CompÃ©tences.L19]+IF(FA;[$'Formes animales'.B32];[$CompÃ©tences.K19])+[CompÃ©tences.I19]+IF([CompÃ©tences.M19]<>"-";[CompÃ©tences.M19];0) -> 3 | C19: HC | E19: HC | G19: HC | I19: of:=INT -> 3 | M19: - | N19: - | O19: of:=[CompÃ©tences.D19]+[CompÃ©tences.F19]+[CompÃ©tences.H19]+[CompÃ©tences.J19] -> 0
A20: DÃ©guisement | B20: of:=[CompÃ©tences.O20]+IF([CompÃ©tences.N20]<>"-";[CompÃ©tences.N20];0)+[CompÃ©tences.L20]+IF(FA;[$'Formes animales'.B33];[$CompÃ©tences.K20])+[CompÃ©tences.I20]+IF([CompÃ©tences.M20]<>"-";[CompÃ©tences.M20];0) -> -1 | C20: HC | E20: HC | G20: HC | I20: of:=CHA -> -1 | M20: - | N20: - | O20: of:=[CompÃ©tences.D20]+[CompÃ©tences.F20]+[CompÃ©tences.H20]+[CompÃ©tences.J20] -> 0 | P20: of:=IF([CompÃ©tences.O5]>=5;"+2 si le personnage se sait observÃ© "&[CompÃ©tences.A4];"Pas encore") -> Pas encore
A21: DÃ©placement silencieux | B21: of:=[CompÃ©tences.O21]+IF([CompÃ©tences.N21]<>"-";[CompÃ©tences.N21];0)+[CompÃ©tences.L21]+IF(FA;[$'Formes animales'.B34];[$CompÃ©tences.K21])+[CompÃ©tences.I21]+IF([CompÃ©tences.M21]<>"-";[CompÃ©tences.M21];0) -> 2 | C21: HC | E21: HC | G21: HC | I21: of:=DEX -> 2 | M21: - | N21: of:=MALUS_TESTS -> 0 | O21: of:=[CompÃ©tences.D21]+[CompÃ©tences.F21]+[CompÃ©tences.H21]+[CompÃ©tences.J21] -> 0
A22: DÃ©samorÃ§age/sabotage | B22: of:=[CompÃ©tences.O22]+IF([CompÃ©tences.N22]<>"-";[CompÃ©tences.N22];0)+[CompÃ©tences.L22]+IF(FA;[$'Formes animales'.B35];[$CompÃ©tences.K22])+[CompÃ©tences.I22]+IF([CompÃ©tences.M22]<>"-";[CompÃ©tences.M22];0) -> 3 | C22: HC | E22: HC | G22: HC | I22: of:=INT -> 3 | M22: - | N22: - | O22: of:=[CompÃ©tences.D22]+[CompÃ©tences.F22]+[CompÃ©tences.H22]+[CompÃ©tences.J22] -> 0
A23: DÃ©tection | B23: of:=[CompÃ©tences.O23]+IF([CompÃ©tences.N23]<>"-";[CompÃ©tences.N23];0)+[CompÃ©tences.L23]+IF(FA;[$'Formes animales'.B36];[$CompÃ©tences.K23])+[CompÃ©tences.I23]+IF([CompÃ©tences.M23]<>"-";[CompÃ©tences.M23];0) -> 24 | C23: Druide | D23: 16 | E23: HC | G23: HC | I23: of:=SAG -> 6 | K23: 2 | M23: - | N23: - | O23: of:=[CompÃ©tences.D23]+[CompÃ©tences.F23]+[CompÃ©tences.H23]+[CompÃ©tences.J23] -> 16
A24: Diplomatie | B24: of:=[CompÃ©tences.O24]+IF([CompÃ©tences.N24]<>"-";[CompÃ©tences.N24];0)+[CompÃ©tences.L24]+IF(FA;[$'Formes animales'.B37];[$CompÃ©tences.K24])+[CompÃ©tences.I24]+IF([CompÃ©tences.M24]<>"-";[CompÃ©tences.M24];0) -> -1 | C24: Druide | E24: HC | G24: HC | I24: of:=CHA -> -1 | M24: of:=IF([CompÃ©tences.O5]>=5;2;0)+IF([CompÃ©tences.O14]>=5;2;0)+IF([CompÃ©tences.O41]>=5;2;0) -> 0 | N24: - | O24: of:=[CompÃ©tences.D24]+[CompÃ©tences.F24]+[CompÃ©tences.H24]+[CompÃ©tences.J24] -> 0
A25: DiscrÃ©tion | B25: of:=[CompÃ©tences.O25]+IF([CompÃ©tences.N25]<>"-";[CompÃ©tences.N25];0)+[CompÃ©tences.L25]+IF(FA;[$'Formes animales'.B38];[$CompÃ©tences.K25])+[CompÃ©tences.I25]+IF([CompÃ©tences.M25]<>"-";[CompÃ©tences.M25];0)+[CompÃ©tences.Q25] -> 2 | C25: HC | E25: HC | G25: HC | I25: of:=DEX -> 2 | M25: - | N25: of:=MALUS_TESTS -> 0 | O25: of:=[CompÃ©tences.D25]+[CompÃ©tences.F25]+[CompÃ©tences.H25]+[CompÃ©tences.J25] -> 0 | P25: Modif. Taille | Q25: of:=TAILLE*4 -> 0
A26: Dressage | B26: of:=[CompÃ©tences.O26]+IF([CompÃ©tences.N26]<>"-";[CompÃ©tences.N26];0)+[CompÃ©tences.L26]+IF(FA;[$'Formes animales'.B39];[$CompÃ©tences.K26])+[CompÃ©tences.I26]+IF([CompÃ©tences.M26]<>"-";[CompÃ©tences.M26];0) -> 1 | C26: Druide | E26: HC | G26: HC | I26: of:=CHA -> -1 | K26: 2 | M26: - | N26: - | O26: of:=[CompÃ©tences.D26]+[CompÃ©tences.F26]+[CompÃ©tences.H26]+[CompÃ©tences.J26] -> 0
A27: Equilibre | B27: of:=[CompÃ©tences.O27]+IF([CompÃ©tences.N27]<>"-";[CompÃ©tences.N27];0)+[CompÃ©tences.L27]+IF(FA;[$'Formes animales'.B40];[$CompÃ©tences.K27])+[CompÃ©tences.I27]+IF([CompÃ©tences.M27]<>"-";[CompÃ©tences.M27];0) -> 2 | C27: HC | E27: HC | G27: HC | I27: of:=DEX -> 2 | M27: of:=IF([CompÃ©tences.O2]>=5;2;0) -> 0 | N27: of:=MALUS_TESTS -> 0 | O27: of:=[CompÃ©tences.D27]+[CompÃ©tences.F27]+[CompÃ©tences.H27]+[CompÃ©tences.J27] -> 0
A28: Equitation | B28: of:=[CompÃ©tences.O28]+IF([CompÃ©tences.N28]<>"-";[CompÃ©tences.N28];0)+[CompÃ©tences.L28]+IF(FA;[$'Formes animales'.B41];[$CompÃ©tences.K28])+[CompÃ©tences.I28]+IF([CompÃ©tences.M28]<>"-";[CompÃ©tences.M28];0) -> 4 | C28: Druide | E28: HC | G28: HC | I28: of:=DEX -> 2 | K28: 2 | M28: of:=IF([CompÃ©tences.O26]>=5;2;0) -> 0 | N28: - | O28: of:=[CompÃ©tences.D28]+[CompÃ©tences.F28]+[CompÃ©tences.H28]+[CompÃ©tences.J28] -> 0
A29: Escalade | B29: of:=[CompÃ©tences.O29]+IF([CompÃ©tences.N29]<>"-";[CompÃ©tences.N29];0)+[CompÃ©tences.L29]+IF(FA;[$'Formes animales'.B42];[$CompÃ©tences.K29])+[CompÃ©tences.I29]+IF([CompÃ©tences.M29]<>"-";[CompÃ©tences.M29];0) -> 1 | C29: HC | E29: HC | G29: HC | I29: of:=FOR -> 1 | M29: - | N29: of:=MALUS_TESTS -> 0 | O29: of:=[CompÃ©tences.D29]+[CompÃ©tences.F29]+[CompÃ©tences.H29]+[CompÃ©tences.J29] -> 0 | P29: of:=IF([CompÃ©tences.O36]>=5;"+2 pour monter aux cordes";"Pas encore") -> Pas encore
A30: Escamotage | B30: of:=[CompÃ©tences.O30]+IF([CompÃ©tences.N30]<>"-";[CompÃ©tences.N30];0)+[CompÃ©tences.L30]+IF(FA;[$'Formes animales'.B43];[$CompÃ©tences.K30])+[CompÃ©tences.I30]+IF([CompÃ©tences.M30]<>"-";[CompÃ©tences.M30];0) -> 2 | C30: HC | E30: HC | G30: HC | I30: of:=DEX -> 2 | M30: of:=IF([CompÃ©tences.O5]>=5;2;0) -> 0 | N30: of:=MALUS_TESTS -> 0 | O30: of:=[CompÃ©tences.D30]+[CompÃ©tences.F30]+[CompÃ©tences.H30]+[CompÃ©tences.J30] -> 0
A31: Estimation | B31: of:=[CompÃ©tences.O31]+IF([CompÃ©tences.N31]<>"-";[CompÃ©tences.N31];0)+[CompÃ©tences.L31]+IF(FA;[$'Formes animales'.B44];[$CompÃ©tences.K31])+[CompÃ©tences.I31]+IF([CompÃ©tences.M31]<>"-";[CompÃ©tences.M31];0) -> 3 | C31: HC | E31: HC | G31: HC | I31: of:=INT -> 3 | M31: - | N31: - | O31: of:=[CompÃ©tences.D31]+[CompÃ©tences.F31]+[CompÃ©tences.H31]+[CompÃ©tences.J31] -> 0 | P31: of:=IF([CompÃ©tences.O4]>=5;"+2 pour estimer les objets liÃ©s Ã  "&[CompÃ©tences.A4];"Pas encore") -> +2 pour estimer les objets liÃ©s Ã  Artisanat (...)
A32: Evasion | B32: of:=[CompÃ©tences.O32]+IF([CompÃ©tences.N32]<>"-";[CompÃ©tences.N32];0)+[CompÃ©tences.L32]+IF(FA;[$'Formes animales'.B45];[$CompÃ©tences.K32])+[CompÃ©tences.I32]+IF([CompÃ©tences.M32]<>"-";[CompÃ©tences.M32];0) -> 2 | C32: HC | E32: HC | G32: HC | I32: of:=DEX -> 2 | M32: - | N32: of:=MALUS_TESTS -> 0 | O32: of:=[CompÃ©tences.D32]+[CompÃ©tences.F32]+[CompÃ©tences.H32]+[CompÃ©tences.J32] -> 0 | P32: of:=IF([CompÃ©tences.O36]>=5;"+2 pour s'Ã©chapper de cordes";"Pas encore") -> Pas encore
A33: Fouille | B33: of:=[CompÃ©tences.O33]+IF([CompÃ©tences.N33]<>"-";[CompÃ©tences.N33];0)+[CompÃ©tences.L33]+IF(FA;[$'Formes animales'.B46];[$CompÃ©tences.K33])+[CompÃ©tences.I33]+IF([CompÃ©tences.M33]<>"-";[CompÃ©tences.M33];0) -> 18 | C33: HC | E33: S. des MarÃ©es | F33: 15 | G33: HC | I33: of:=INT -> 3 | M33: - | N33: - | O33: of:=[CompÃ©tences.D33]+[CompÃ©tences.F33]+[CompÃ©tences.H33]+[CompÃ©tences.J33] -> 15
A34: Intimidation | B34: of:=[CompÃ©tences.O34]+IF([CompÃ©tences.N34]<>"-";[CompÃ©tences.N34];0)+[CompÃ©tences.L34]+IF(FA;[$'Formes animales'.B47];[$CompÃ©tences.K34])+[CompÃ©tences.I34]+IF([CompÃ©tences.M34]<>"-";[CompÃ©tences.M34];0) -> -1 | C34: HC | E34: HC | G34: HC | I34: of:=CHA -> -1 | M34: of:=IF([CompÃ©tences.O5]>=5;2;0) -> 0 | N34: - | O34: of:=[CompÃ©tences.D34]+[CompÃ©tences.F34]+[CompÃ©tences.H34]+[CompÃ©tences.J34] -> 0
A35: Langue | B35: of:=[CompÃ©tences.O35]+IF([CompÃ©tences.N35]<>"-";[CompÃ©tences.N35];0)+[CompÃ©tences.L35]+IF(FA;[$'Formes animales'.B48];[$CompÃ©tences.K35])+[CompÃ©tences.I35]+IF([CompÃ©tences.M35]<>"-";[CompÃ©tences.M35];0) -> 0 | C35: HC | E35: HC | G35: HC | I35: 0 | M35: - | N35: - | O35: of:=[CompÃ©tences.D35]+[CompÃ©tences.F35]+[CompÃ©tences.H35]+[CompÃ©tences.J35] -> 0
A36: MaÃ®trise des cordes | B36: of:=[CompÃ©tences.O36]+IF([CompÃ©tences.N36]<>"-";[CompÃ©tences.N36];0)+[CompÃ©tences.L36]+IF(FA;[$'Formes animales'.B49];[$CompÃ©tences.K36])+[CompÃ©tences.I36]+IF([CompÃ©tences.M36]<>"-";[CompÃ©tences.M36];0) -> 2 | C36: HC | E36: HC | G36: HC | I36: of:=DEX -> 2 | M36: - | N36: - | O36: of:=[CompÃ©tences.D36]+[CompÃ©tences.F36]+[CompÃ©tences.H36]+[CompÃ©tences.J36] -> 0 | P36: of:=IF([CompÃ©tences.O32]>=5;"+2 pour ligoter qqun";"Pas encore") -> Pas encore
A37: Natation | B37: of:=[CompÃ©tences.O37]+IF([CompÃ©tences.N37]<>"-";[CompÃ©tences.N37];0)+[CompÃ©tences.L37]+IF(FA;[$'Formes animales'.B50];[$CompÃ©tences.K37])+[CompÃ©tences.I37]+IF([CompÃ©tences.M37]<>"-";[CompÃ©tences.M37];0) -> 1 | C37: Druide | E37: HC | G37: HC | I37: of:=FOR -> 1 | M37: - | N37: of:=MALUS_TESTS*2 -> 0 | O37: of:=[CompÃ©tences.D37]+[CompÃ©tences.F37]+[CompÃ©tences.H37]+[CompÃ©tences.J37] -> 0
A38: Perception auditive | B38: of:=[CompÃ©tences.O38]+IF([CompÃ©tences.N38]<>"-";[CompÃ©tences.N38];0)+[CompÃ©tences.L38]+IF(FA;[$'Formes animales'.B51];[$CompÃ©tences.K38])+[CompÃ©tences.I38]+IF([CompÃ©tences.M38]<>"-";[CompÃ©tences.M38];0) -> 19 | C38: Druide | D38: 8 | E38: S. des MarÃ©es | F38: 5 | G38: HC | I38: of:=SAG -> 6 | M38: - | N38: - | O38: of:=[CompÃ©tences.D38]+[CompÃ©tences.F38]+[CompÃ©tences.H38]+[CompÃ©tences.J38] -> 13
A39: Premiers secours | B39: of:=[CompÃ©tences.O39]+IF([CompÃ©tences.N39]<>"-";[CompÃ©tences.N39];0)+[CompÃ©tences.L39]+IF(FA;[$'Formes animales'.B52];[$CompÃ©tences.K39])+[CompÃ©tences.I39]+IF([CompÃ©tences.M39]<>"-";[CompÃ©tences.M39];0) -> 12 | C39: Druide | D39: 6 | E39: HC | G39: HC | I39: of:=SAG -> 6 | M39: - | N39: - | O39: of:=[CompÃ©tences.D39]+[CompÃ©tences.F39]+[CompÃ©tences.H39]+[CompÃ©tences.J39] -> 6
A40: Profession (â¦) | B40: of:=[CompÃ©tences.O40]+IF([CompÃ©tences.N40]<>"-";[CompÃ©tences.N40];0)+[CompÃ©tences.L40]+IF(FA;[$'Formes animales'.B53];[$CompÃ©tences.K40])+[CompÃ©tences.I40]+IF([CompÃ©tences.M40]<>"-";[CompÃ©tences.M40];0) -> 6 | C40: Druide | E40: S. des MarÃ©es | G40: HC | I40: of:=SAG -> 6 | M40: - | N40: - | O40: of:=[CompÃ©tences.D40]+[CompÃ©tences.F40]+[CompÃ©tences.H40]+[CompÃ©tences.J40] -> 0
A41: Psychologie | B41: of:=[CompÃ©tences.O41]+IF([CompÃ©tences.N41]<>"-";[CompÃ©tences.N41];0)+[CompÃ©tences.L41]+IF(FA;[$'Formes animales'.B54];[$CompÃ©tences.K41])+[CompÃ©tences.I41]+IF([CompÃ©tences.M41]<>"-";[CompÃ©tences.M41];0) -> 6 | C41: HC | E41: HC | G41: HC | I41: of:=SAG -> 6 | M41: - | N41: - | O41: of:=[CompÃ©tences.D41]+[CompÃ©tences.F41]+[CompÃ©tences.H41]+[CompÃ©tences.J41] -> 0
A42: Renseignements | B42: of:=[CompÃ©tences.O42]+IF([CompÃ©tences.N42]<>"-";[CompÃ©tences.N42];0)+[CompÃ©tences.L42]+IF(FA;[$'Formes animales'.B55];[$CompÃ©tences.K42])+[CompÃ©tences.I42]+IF([CompÃ©tences.M42]<>"-";[CompÃ©tences.M42];0) -> -1 | C42: HC | E42: HC | G42: HC | I42: of:=CHA -> -1 | M42: of:=IF([CompÃ©tences.O9]>=5;2;0) -> 0 | N42: - | O42: of:=[CompÃ©tences.D42]+[CompÃ©tences.F42]+[CompÃ©tences.H42]+[CompÃ©tences.J42] -> 0
A43: ReprÃ©sentation (â¦) | B43: of:=[CompÃ©tences.O43]+IF([CompÃ©tences.N43]<>"-";[CompÃ©tences.N43];0)+[CompÃ©tences.L43]+IF(FA;[$'Formes animales'.B56];[$CompÃ©tences.K43])+[CompÃ©tences.I43]+IF([CompÃ©tences.M43]<>"-";[CompÃ©tences.M43];0) -> -1 | C43: HC | E43: HC | G43: HC | I43: of:=CHA -> -1 | M43: - | N43: - | O43: of:=[CompÃ©tences.D43]+[CompÃ©tences.F43]+[CompÃ©tences.H43]+[CompÃ©tences.J43] -> 0
A44: Saut | B44: of:=[CompÃ©tences.O44]+IF([CompÃ©tences.N44]<>"-";[CompÃ©tences.N44];0)+[CompÃ©tences.L44]+IF(FA;[$'Formes animales'.B57];[$CompÃ©tences.K44])+[CompÃ©tences.I44]+IF([CompÃ©tences.M44]<>"-";[CompÃ©tences.M44];0)+[CompÃ©tences.R44] -> 1 | C44: HC | E44: HC | G44: HC | I44: of:=FOR -> 1 | M44: of:=IF([CompÃ©tences.O2]>=5;2;0) -> 0 | N44: of:=MALUS_TESTS -> 0 | O44: of:=[CompÃ©tences.D44]+[CompÃ©tences.F44]+[CompÃ©tences.H44]+[CompÃ©tences.J44] -> 0 | P44: Modificateurs dÃ©placement | R44: of:=IF(VITESSE>9;4*(VITESSE-9)/3;IF(VITESSE<9;-6*(9-VITESSE)/3;0)) -> 0 | T44: Instinct naturel
A45: Survie | B45: of:=[CompÃ©tences.O45]+IF([CompÃ©tences.N45]<>"-";[CompÃ©tences.N45];0)+[CompÃ©tences.L45]+IF(FA;[$'Formes animales'.B58];[$CompÃ©tences.K45])+[CompÃ©tences.I45]+IF([CompÃ©tences.M45]<>"-";[CompÃ©tences.M45];0) -> 21 | C45: Druide | D45: 8 | E45: S. des MarÃ©es | F45: 5 | G45: HC | I45: of:=SAG -> 6 | L45: 2 | M45: - | N45: - | O45: of:=[CompÃ©tences.D45]+[CompÃ©tences.F45]+[CompÃ©tences.H45]+[CompÃ©tences.J45] -> 13 | P45: of:=IF([CompÃ©tences.O33]>=5;"+2 pour suivre une piste ; ";"")&IF([CompÃ©tences.O8]>=5;"+2 sous terre ; ";"")&IF([CompÃ©tences.O15]>=5;"+2 dans un autre plan ; ";"")&IF([CompÃ©tences.O13]>=5;"+2 dans la nature (en surface) ; ";"")&IF([CompÃ©tences.O13]>=5;"+2 pour Ã©viter de se perdre et Ã©viter les dangers";"Pas encore") -> +2 pour suivre une piste ; +2 dans un autre plan ; +2 dans la nature (en surface) ; +2 pour Ã©viter de se perdre et Ã©viter les dangers
A46: Utilisation d'objets magiques | B46: of:=[CompÃ©tences.O46]+IF([CompÃ©tences.N46]<>"-";[CompÃ©tences.N46];0)+[CompÃ©tences.L46]+IF(FA;[$'Formes animales'.B59];[$CompÃ©tences.K46])+[CompÃ©tences.I46]+IF([CompÃ©tences.M46]<>"-";[CompÃ©tences.M46];0) -> -1 | C46: HC | E46: HC | G46: HC | I46: of:=CHA -> -1 | M46: - | N46: - | O46: of:=[CompÃ©tences.D46]+[CompÃ©tences.F46]+[CompÃ©tences.H46]+[CompÃ©tences.J46] -> 0 | P46: of:=IF(OR([CompÃ©tences.O3]>=5;[CompÃ©tences.O19]>=5);"+2 pour utiliser les parchemins";"Pas encore") -> Pas encore
A48: Classe | B48: Somme | C48: Calcul auto | D48: Deg. Max
A49: of:=CLASSE1 -> Druide | B49: of:=SUMIF([CompÃ©tences.$C$2:.$C$46];[CompÃ©tences.A49];[CompÃ©tences.$D$2:.$D$46])+SUMIF([CompÃ©tences.$E$2:.$E$46];[CompÃ©tences.A49];[CompÃ©tences.$F$2:.$F$46])+SUMIF([CompÃ©tences.$G$2:.$G$46];[CompÃ©tences.A49];[CompÃ©tences.$H$2:.$H$46]) -> 63 | C49: of:=IF(NIV_CLASSE1<>0;(NIV_CLASSE1+3)*(4+INT-INT_ALT/2);0) -> 63 | D49: of:=NIV_CLASSE1+NIV_CLASSE2+NIV_CLASSE3+3 -> 16
A50: of:=CLASSE2 -> S. des MarÃ©es | B50: of:=SUMIF([CompÃ©tences.$C$2:.$C$46];[CompÃ©tences.A50];[CompÃ©tences.$D$2:.$D$46])+SUMIF([CompÃ©tences.$E$2:.$E$46];[CompÃ©tences.A50];[CompÃ©tences.$F$2:.$F$46])+SUMIF([CompÃ©tences.$G$2:.$G$46];[CompÃ©tences.A50];[CompÃ©tences.$H$2:.$H$46]) -> 49 | C50: of:=IF(NIV_CLASSE2<>0;(NIV_CLASSE2)*(4+INT-INT_ALT/2);0) -> 49 | D50: of:=NIV_CLASSE1+NIV_CLASSE2+NIV_CLASSE3+3 -> 16
A51: of:=CLASSE3 -> 0 | B51: of:=SUMIF([CompÃ©tences.$C$2:.$C$46];[CompÃ©tences.A51];[CompÃ©tences.$D$2:.$D$46])+SUMIF([CompÃ©tences.$E$2:.$E$46];[CompÃ©tences.A51];[CompÃ©tences.$F$2:.$F$46])+SUMIF([CompÃ©tences.$G$2:.$G$46];[CompÃ©tences.A51];[CompÃ©tences.$H$2:.$H$46]) -> 0 | C51: of:=IF(NIV_CLASSE3<>0;(NIV_CLASSE3)*(2+INT-INT_ALT/2);0) -> 0 | D51: of:=NIV_CLASSE1+NIV_CLASSE2+NIV_CLASSE3+3 -> 16
A52: HC | B52: of:=(SUMIF([CompÃ©tences.$C$2:.$C$46];[CompÃ©tences.A52];[CompÃ©tences.$D$2:.$D$46])+SUMIF([CompÃ©tences.$E$2:.$E$46];[CompÃ©tences.A52];[CompÃ©tences.$F$2:.$F$46])+SUMIF([CompÃ©tences.$G$2:.$G$46];[CompÃ©tences.A52];[CompÃ©tences.$H$2:.$H$46]))*2 -> 0 | C52: of:=SUM([CompÃ©tences.C49:.C51])-SUM([CompÃ©tences.B49:.B51]) -> 0 | D52: of:=(NIV_CLASSE1+NIV_CLASSE2+NIV_CLASSE3)*0.5+1 -> 7.5
B53: OK ? | C53: of:=IF([CompÃ©tences.B52]=[CompÃ©tences.C52];"Oui";"Non") -> Oui
B54: Restant | C54: of:=SUM([CompÃ©tences.C49:.C51])-SUM([CompÃ©tences.B49:.B52]) -> 0

Sheet: Equipement
A1: Objets magiques | B1: QuantitÃ© | C1: Prix(po) | D1: Poids(kg) | E1: Total prix(po) | F1: Total poids(kg) | G1: Facteur de poids = | H1: of:=IF(TAILLE>0;1/(2*TAILLE);IF(TAILLE<0;-2*TAILLE;1)) -> 1 | I1: Facteur de charge = | K1: of:=IF(TAILLE>0;3/(3+TAILLE);IF(TAILLE<0;(4-TAILLE)/3;1)) -> 1
E2: of:=[Equipement.B2]*[Equipement.C2] -> 0 | F2: of:=[Equipement.B2]*[Equipement.D2] -> 0 | G2: TÃªte
E3: of:=[Equipement.B3]*[Equipement.C3] -> 0 | F3: of:=[Equipement.B3]*[Equipement.D3] -> 0 | G3: Yeux
A4: MÃ©daillon de Sagesse +4 | B4: 1 | C4: 16000 | D4: 0.05 | E4: of:=[Equipement.B4]*[Equipement.C4] -> 16000 | F4: of:=[Equipement.B4]*[Equipement.D4] -> 0.05 | G4: Cou
E5: of:=[Equipement.B5]*[Equipement.C5] -> 0 | F5: of:=[Equipement.B5]*[Equipement.D5] -> 0 | G5: Epaule
E6: of:=[Equipement.B6]*[Equipement.C6] -> 0 | F6: of:=[Equipement.B6]*[Equipement.D6] -> 0 | G6: Anneau1
E7: of:=[Equipement.B7]*[Equipement.C7] -> 0 | F7: of:=[Equipement.B7]*[Equipement.D7] -> 0 | G7: Anneau2
E8: of:=[Equipement.B8]*[Equipement.C8] -> 0 | F8: of:=[Equipement.B8]*[Equipement.D8] -> 0 | G8: Mains
E9: of:=[Equipement.B9]*[Equipement.C9] -> 0 | F9: of:=[Equipement.B9]*[Equipement.D9] -> 0 | G9: Bras ou poignets
A10: Cuirasse en bois cendrÃ© +1 | B10: 1 | C10: of:=3200+1000 -> 4200 | D10: 7 | E10: of:=[Equipement.B10]*[Equipement.C10] -> 4200 | F10: of:=[Equipement.B10]*[Equipement.D10] -> 7 | G10: Corps | H10: LÃ©gÃ¨re, CA +6, DexMax +4, Malus -2
E11: of:=[Equipement.B11]*[Equipement.C11] -> 0 | F11: of:=[Equipement.B11]*[Equipement.D11] -> 0 | G11: Torse
E12: of:=[Equipement.B12]*[Equipement.C12] -> 0 | F12: of:=[Equipement.B12]*[Equipement.D12] -> 0 | G12: Taille
E13: of:=[Equipement.B13]*[Equipement.C13] -> 0 | F13: of:=[Equipement.B13]*[Equipement.D13] -> 0 | G13: Pieds
A14: Pierre ion Bleu pÃ¢le (+2 Force) | B14: 1 | C14: 8000 | D14: 0 | E14: of:=[Equipement.B14]*[Equipement.C14] -> 8000 | F14: of:=[Equipement.B14]*[Equipement.D14] -> 0 | G14: Autre
A15: Pierre ion Rose vif (+2 Constitution) | B15: 1 | C15: 8000 | D15: 0 | E15: of:=[Equipement.B15]*[Equipement.C15] -> 8000 | F15: of:=[Equipement.B15]*[Equipement.D15] -> 0 | G15: Autre
A16: Armes et autres objets
A17: Cimeterre +1 | B17: 1 | C17: of:=2315 -> 2315 | D17: 2 | E17: of:=[Equipement.B17]*[Equipement.C17] -> 2315 | F17: of:=[Equipement.B17]*[Equipement.D17]*[Equipement.$H$1] -> 2
A18: Arc court +1 | B18: 1 | C18: 2375 | D18: 1 | E18: of:=[Equipement.B18]*[Equipement.C18] -> 2375 | F18: of:=[Equipement.B18]*[Equipement.D18]*[Equipement.$H$1] -> 1
A19: FlÃ¨che | B19: 20 | C19: of:=1/20 -> 0.05 | D19: of:=1.5/20 -> 0.075 | E19: of:=[Equipement.B19]*[Equipement.C19] -> 1 | F19: of:=[Equipement.B19]*[Equipement.D19]*[Equipement.$H$1] -> 1.5
A20: Ecu en Ã©bÃ©nite +1 | B20: 1 | C20: 1257 | D20: 5 | E20: of:=[Equipement.B20]*[Equipement.C20] -> 1257 | F20: of:=[Equipement.B20]*[Equipement.D20]*[Equipement.$H$1] -> 5 | H20: +2 CA, pas de malus
A21: Carafe intarissable | B21: 1 | C21: 9000 | D21: 1 | E21: of:=[Equipement.B21]*[Equipement.C21] -> 9000 | F21: of:=[Equipement.B21]*[Equipement.D21]*[Equipement.$H$1] -> 1 | H21: Voir ici
E22: of:=[Equipement.B22]*[Equipement.C22] -> 0 | F22: of:=[Equipement.B22]*[Equipement.D22]*[Equipement.$H$1] -> 0
A23: farine | B23: 2 | C23: 0.04 | D23: 1 | E23: of:=[Equipement.B23]*[Equipement.C23] -> 0.08 | F23: of:=[Equipement.B23]*[Equipement.D23]*[Equipement.$H$1] -> 2
A24: torches | B24: 2 | C24: 0.01 | D24: 0.5 | E24: of:=[Equipement.B24]*[Equipement.C24] -> 0.02 | F24: of:=[Equipement.B24]*[Equipement.D24]*[Equipement.$H$1] -> 1
A25: baies nouriciÃ¨re | B25: 18 | C25: 0 | D25: 0.01 | E25: of:=[Equipement.B25]*[Equipement.C25] -> 0 | F25: of:=[Equipement.B25]*[Equipement.D25]*[Equipement.$H$1] -> 0.18
E26: of:=[Equipement.B26]*[Equipement.C26] -> 0 | F26: of:=[Equipement.B26]*[Equipement.D26]*[Equipement.$H$1] -> 0
E27: of:=[Equipement.B27]*[Equipement.C27] -> 0 | F27: of:=[Equipement.B27]*[Equipement.D27]*[Equipement.$H$1] -> 0
E28: of:=[Equipement.B28]*[Equipement.C28] -> 0 | F28: of:=[Equipement.B28]*[Equipement.D28]*[Equipement.$H$1] -> 0
E29: of:=[Equipement.B29]*[Equipement.C29] -> 0 | F29: of:=[Equipement.B29]*[Equipement.D29]*[Equipement.$H$1] -> 0
E30: of:=[Equipement.B30]*[Equipement.C30] -> 0 | F30: of:=[Equipement.B30]*[Equipement.D30]*[Equipement.$H$1] -> 0
E31: of:=[Equipement.B31]*[Equipement.C31] -> 0 | F31: of:=[Equipement.B31]*[Equipement.D31]*[Equipement.$H$1] -> 0
E32: of:=[Equipement.B32]*[Equipement.C32] -> 0 | F32: of:=[Equipement.B32]*[Equipement.D32]*[Equipement.$H$1] -> 0
E33: of:=[Equipement.B33]*[Equipement.C33] -> 0 | F33: of:=[Equipement.B33]*[Equipement.D33]*[Equipement.$H$1] -> 0
E34: of:=[Equipement.B34]*[Equipement.C34] -> 0 | F34: of:=[Equipement.B34]*[Equipement.D34]*[Equipement.$H$1] -> 0
A35: Baguettes | E35: of:=[Equipement.B35]*[Equipement.C35] -> 0 | F35: of:=[Equipement.B35]*[Equipement.D35] -> 0 | G35: charge | H35: nls | I35: nivS
A36: Baguette de soins importants | B36: 1 | C36: of:=750*[Equipement.I36]*[Equipement.H36]*[Equipement.G36]/50 -> 15750 | D36: 0.5 | E36: of:=[Equipement.B36]*[Equipement.C36] -> 15750 | F36: of:=[Equipement.B36]*[Equipement.D36] -> 0.5 | G36: 50 | H36: 7 | I36: 3
C37: of:=750*[Equipement.I37]*[Equipement.H37]*[Equipement.G37]/50 -> 0 | D37: 0.5 | E37: of:=[Equipement.B37]*[Equipement.C37] -> 0 | F37: of:=[Equipement.B37]*[Equipement.D37] -> 0
C38: of:=750*[Equipement.I38]*[Equipement.H38]*[Equipement.G38]/50 -> 0 | D38: 0.5 | E38: of:=[Equipement.B38]*[Equipement.C38] -> 0 | F38: of:=[Equipement.B38]*[Equipement.D38] -> 0
C39: of:=750*[Equipement.I39]*[Equipement.H39]*[Equipement.G39]/50 -> 0 | D39: 0.5 | E39: of:=[Equipement.B39]*[Equipement.C39] -> 0 | F39: of:=[Equipement.B39]*[Equipement.D39] -> 0
C40: of:=750*[Equipement.I40]*[Equipement.H40]*[Equipement.G40]/50 -> 0 | D40: 0.5 | E40: of:=[Equipement.B40]*[Equipement.C40] -> 0 | F40: of:=[Equipement.B40]*[Equipement.D40] -> 0
C41: of:=750*[Equipement.I41]*[Equipement.H41]*[Equipement.G41]/50 -> 0 | D41: 0.5 | E41: of:=[Equipement.B41]*[Equipement.C41] -> 0 | F41: of:=[Equipement.B41]*[Equipement.D41] -> 0
C42: of:=750*[Equipement.I42]*[Equipement.H42]*[Equipement.G42]/50 -> 0 | D42: 0.5 | E42: of:=[Equipement.B42]*[Equipement.C42] -> 0 | F42: of:=[Equipement.B42]*[Equipement.D42] -> 0
C43: of:=750*[Equipement.I43]*[Equipement.H43]*[Equipement.G43]/50 -> 0 | D43: 0.5 | E43: of:=[Equipement.B43]*[Equipement.C43] -> 0 | F43: of:=[Equipement.B43]*[Equipement.D43] -> 0
C44: of:=750*[Equipement.I44]*[Equipement.H44]*[Equipement.G44]/50 -> 0 | D44: 0.5 | E44: of:=[Equipement.B44]*[Equipement.C44] -> 0 | F44: of:=[Equipement.B44]*[Equipement.D44] -> 0
C45: of:=750*[Equipement.I45]*[Equipement.H45]*[Equipement.G45]/50 -> 0 | D45: 0.5 | E45: of:=[Equipement.B45]*[Equipement.C45] -> 0 | F45: of:=[Equipement.B45]*[Equipement.D45] -> 0
A46: Potions | E46: of:=[Equipement.B46]*[Equipement.C46] -> 0 | F46: of:=[Equipement.B46]*[Equipement.D46] -> 0 | G46: nls | H46: nivS
C47: of:=50*[Equipement.H47]*[Equipement.G47] -> 50 | D47: 0.5 | E47: of:=[Equipement.B47]*[Equipement.C47] -> 0 | F47: of:=[Equipement.B47]*[Equipement.D47] -> 0 | G47: 1 | H47: 1
C48: of:=50*[Equipement.H48]*[Equipement.G48] -> 50 | D48: 0.5 | E48: of:=[Equipement.B48]*[Equipement.C48] -> 0 | F48: of:=[Equipement.B48]*[Equipement.D48] -> 0 | G48: 1 | H48: 1
C49: of:=50*[Equipement.H49]*[Equipement.G49] -> 50 | D49: 0.5 | E49: of:=[Equipement.B49]*[Equipement.C49] -> 0 | F49: of:=[Equipement.B49]*[Equipement.D49] -> 0 | G49: 1 | H49: 1
C50: of:=50*[Equipement.H50]*[Equipement.G50] -> 0 | D50: 0.5 | E50: of:=[Equipement.B50]*[Equipement.C50] -> 0 | F50: of:=[Equipement.B50]*[Equipement.D50] -> 0
C51: of:=50*[Equipement.H51]*[Equipement.G51] -> 0 | D51: 0.5 | E51: of:=[Equipement.B51]*[Equipement.C51] -> 0 | F51: of:=[Equipement.B51]*[Equipement.D51] -> 0
C52: of:=50*[Equipement.H52]*[Equipement.G52] -> 0 | D52: 0.5 | E52: of:=[Equipement.B52]*[Equipement.C52] -> 0 | F52: of:=[Equipement.B52]*[Equipement.D52] -> 0
C53: of:=50*[Equipement.H53]*[Equipement.G53] -> 0 | D53: 0.5 | E53: of:=[Equipement.B53]*[Equipement.C53] -> 0 | F53: of:=[Equipement.B53]*[Equipement.D53] -> 0
C54: of:=50*[Equipement.H54]*[Equipement.G54] -> 0 | D54: 0.5 | E54: of:=[Equipement.B54]*[Equipement.C54] -> 0 | F54: of:=[Equipement.B54]*[Equipement.D54] -> 0
C55: of:=50*[Equipement.H55]*[Equipement.G55] -> 0 | D55: 0.5 | E55: of:=[Equipement.B55]*[Equipement.C55] -> 0 | F55: of:=[Equipement.B55]*[Equipement.D55] -> 0
C56: of:=50*[Equipement.H56]*[Equipement.G56] -> 0 | D56: 0.5 | E56: of:=[Equipement.B56]*[Equipement.C56] -> 0 | F56: of:=[Equipement.B56]*[Equipement.D56] -> 0
A57: Parchemins | E57: of:=[Equipement.B57]*[Equipement.C57] -> 0 | F57: of:=[Equipement.B57]*[Equipement.D57] -> 0 | G57: nls | H57: nivS
C58: of:=25*[Equipement.H58]*[Equipement.G58] -> 25 | D58: 0.5 | E58: of:=[Equipement.B58]*[Equipement.C58] -> 0 | F58: of:=[Equipement.B58]*[Equipement.D58] -> 0 | G58: 1 | H58: 1
C59: of:=25*[Equipement.H59]*[Equipement.G59] -> 25 | D59: 0.5 | E59: of:=[Equipement.B59]*[Equipement.C59] -> 0 | F59: of:=[Equipement.B59]*[Equipement.D59] -> 0 | G59: 1 | H59: 1
C60: of:=25*[Equipement.H60]*[Equipement.G60] -> 25 | D60: 0.5 | E60: of:=[Equipement.B60]*[Equipement.C60] -> 0 | F60: of:=[Equipement.B60]*[Equipement.D60] -> 0 | G60: 1 | H60: 1
C61: of:=25*[Equipement.H61]*[Equipement.G61] -> 0 | D61: 0.5 | E61: of:=[Equipement.B61]*[Equipement.C61] -> 0 | F61: of:=[Equipement.B61]*[Equipement.D61] -> 0
C62: of:=25*[Equipement.H62]*[Equipement.G62] -> 0 | D62: 0.5 | E62: of:=[Equipement.B62]*[Equipement.C62] -> 0 | F62: of:=[Equipement.B62]*[Equipement.D62] -> 0
C63: of:=25*[Equipement.H63]*[Equipement.G63] -> 0 | D63: 0.5 | E63: of:=[Equipement.B63]*[Equipement.C63] -> 0 | F63: of:=[Equipement.B63]*[Equipement.D63] -> 0
C64: of:=25*[Equipement.H64]*[Equipement.G64] -> 0 | D64: 0.5 | E64: of:=[Equipement.B64]*[Equipement.C64] -> 0 | F64: of:=[Equipement.B64]*[Equipement.D64] -> 0
C65: of:=25*[Equipement.H65]*[Equipement.G65] -> 0 | D65: 0.5 | E65: of:=[Equipement.B65]*[Equipement.C65] -> 0 | F65: of:=[Equipement.B65]*[Equipement.D65] -> 0
C66: of:=25*[Equipement.H66]*[Equipement.G66] -> 0 | D66: 0.5 | E66: of:=[Equipement.B66]*[Equipement.C66] -> 0 | F66: of:=[Equipement.B66]*[Equipement.D66] -> 0
C67: of:=25*[Equipement.H67]*[Equipement.G67] -> 0 | D67: 0.5 | E67: of:=[Equipement.B67]*[Equipement.C67] -> 0 | F67: of:=[Equipement.B67]*[Equipement.D67] -> 0
A68: Gemmes
E69: of:=[Equipement.B69]*[Equipement.C69] -> 0 | F69: of:=[Equipement.B69]*[Equipement.D69] -> 0
E70: of:=[Equipement.B70]*[Equipement.C70] -> 0 | F70: of:=[Equipement.B70]*[Equipement.D70] -> 0
E71: of:=[Equipement.B71]*[Equipement.C71] -> 0 | F71: of:=[Equipement.B71]*[Equipement.D71] -> 0
E72: of:=[Equipement.B72]*[Equipement.C72] -> 0 | F72: of:=[Equipement.B72]*[Equipement.D72] -> 0
A73: Autres objets de valeur
E74: of:=[Equipement.B74]*[Equipement.C74] -> 0 | F74: of:=[Equipement.B74]*[Equipement.D74] -> 0
E75: of:=[Equipement.B75]*[Equipement.C75] -> 0 | F75: of:=[Equipement.B75]*[Equipement.D75] -> 0
E76: of:=[Equipement.B76]*[Equipement.C76] -> 0 | F76: of:=[Equipement.B76]*[Equipement.D76] -> 0
E77: of:=[Equipement.B77]*[Equipement.C77] -> 0 | F77: of:=[Equipement.B77]*[Equipement.D77] -> 0
A79: pc | B79: 8 | C79: 0.01 | D79: 0.01 | E79: of:=[Equipement.B79]*[Equipement.C79] -> 0.08 | F79: of:=[Equipement.B79]*[Equipement.D79] -> 0.08
A80: pa | B80: 7 | C80: 0.1 | D80: 0.01 | E80: of:=[Equipement.B80]*[Equipement.C80] -> 0.7 | F80: of:=[Equipement.B80]*[Equipement.D80] -> 0.07
A81: po | B81: 98 | C81: 1 | D81: of:=1/100 -> 0.01 | E81: of:=[Equipement.B81]*[Equipement.C81] -> 98 | F81: of:=[Equipement.B81]*[Equipement.D81] -> 0.98
A82: pp | B82: 0 | C82: 10 | D82: 0.01 | E82: of:=[Equipement.B82]*[Equipement.C82] -> 0 | F82: of:=[Equipement.B82]*[Equipement.D82] -> 0
A83: sac Ã dos | B83: 1 | C83: 2 | D83: 1 | E83: of:=[Equipement.B83]*[Equipement.C83] -> 2 | F83: of:=[Equipement.B83]*[Equipement.D83] -> 1 | G83: LÃ©gÃ¨re | H83: IntermÃ©diaire | I83: Lourde
D84: Total des totaux | E84: of:=SUM([Equipement.E2:.E83]) -> 66998.88 | F84: of:=SUM([Equipement.F2:.F83]) -> 23.36 | G84: of:=VLOOKUP(FORCE_TOTAL;[$Ref.A2:.D30];2;0)*[Equipement.K1] -> 25 | H84: of:=VLOOKUP(FORCE_TOTAL;[$Ref.A2:.D30];3;0)*[Equipement.K1] -> 50 | I84: of:=VLOOKUP(FORCE_TOTAL;[$Ref.A2:.D30];4;0)*[Equipement.K1] -> 75
A85: Somme piÃ¨ces | B85: of:=SUM([Equipement.E79:.E82]) -> 98.78 | E85: Malus encombrement | F85: of:=IF((CHARGE)>INTERMEDIAIRE;-6;IF((CHARGE)>LEGERE;-3;0)) -> 0 | H85: Lever | I85: of:=LOURDE -> 75 | J85: Au-dessus de la tÃªte
A86: Somme gemmes | B86: of:=SUM([Equipement.E69:.E72]) -> 0 | E86: Dex max encombrement | F86: of:=IF((CHARGE)>LOURDE;0;IF((CHARGE)>INTERMEDIAIRE;1;IF((CHARGE)>LEGERE;3;"-"))) -> - | H86: Soulever | I86: of:=LOURDE*2 -> 150 | J86: A quelques centimÃ¨tres du sol
A87: Autres objets de valeur (prix Ã la vente) | B87: of:=SUM([Equipement.E74:.E77])/2 -> 0 | E87: Vitesse rÃ©duite encomb. | F87: of:=IF(CHARGE>LOURDE;1.5;IF((CHARGE)>LEGERE;IF((VITESSE_RACIAL+VITESSE_BONUS)>15;12;IF((VITESSE_RACIAL+VITESSE_BONUS)>12;10.5;IF((VITESSE_RACIAL+VITESSE_BONUS)>9;9;IF((VITESSE_RACIAL+VITESSE_BONUS)>6;6;4.5))));VITESSE_RACIAL+VITESSE_BONUS)) -> 9 | H87: Pousser | I87: of:=LOURDE*5 -> 375
A88: Somme des liquiditÃ©s | B88: of:=SUM([Equipement.B85:.B87]) -> 98.78 | E88: Malus armure + bouclier | F88: 0
E89: Dex max armure/bouclier | F89: -
E90: Vitesse rÃ©duite armure | F90: of:=IF(OR([Equipement.H90]="IntermÃ©diaire";[Equipement.H90]="Lourde");IF((VITESSE_RACIAL+VITESSE_BONUS)>15;12;IF((VITESSE_RACIAL+VITESSE_BONUS)>12;10.5;IF((VITESSE_RACIAL+VITESSE_BONUS)>9;9;IF((VITESSE_RACIAL+VITESSE_BONUS)>6;6;4.5))));(VITESSE_RACIAL+VITESSE_BONUS)) -> 9 | G90: Type : | H90: Aucune
E91: Total Malus | F91: of:=MIN(MALUS_TESTS_ARMURE;MALUS_TESTS_ENCOMB) -> 0
E92: Total Dex max | F92: of:=IF(AND(DEX_MAX_ARMURE<>"-";DEX_MAX_ENCOMB<>"-");MIN(DEX_MAX_ENCOMB;DEX_MAX_ARMURE);IF(DEX_MAX_ARMURE<>"-";DEX_MAX_ARMURE;IF(DEX_MAX_ENCOMB<>"-";DEX_MAX_ENCOMB;"-"))) -> -
E93: Total Vitesse rÃ©duite Ã | F93: of:=MIN(VITESSE_REDUC_ARMURE;VITESSE_REDUC_ENCOMB) -> 9

Sheet: Formes animales
A1: SÃ©lection | B1: GuÃ©pard
A2: Forme | B2: of:=""&HLOOKUP(['Formes animales'.$B$1];['Formes animales'.$C$2:.$AA$99];ROW(['Formes animales'.A2])-ROW(['Formes animales'.$A$1]);0) -> GuÃ©pard | C2: Serval | D2: Vautour | E2: Serpent C. | F2: Serpent V. | G2: GuÃ©pard | H2: Crocodile | I2: Faucon | J2: Aigle | K2: Varan
A3: Type | B3: of:=""&HLOOKUP(['Formes animales'.$B$1];['Formes animales'.$C$2:.$AA$99];ROW(['Formes animales'.A3])-ROW(['Formes animales'.$A$1]);0) -> Animal | C3: Animal | D3: Animal | E3: Animal | F3: Animal | G3: Animal | H3: Animal | I3: Animal | J3: Animal | K3: Animal | L3: Animal | M3: Animal | N3: Animal | O3: Animal | P3: Animal | Q3: Animal | R3: Animal | S3: Animal | T3: Animal | U3: Animal
A4: DV | B4: of:=""&HLOOKUP(['Formes animales'.$B$1];['Formes animales'.$C$2:.$AA$99];ROW(['Formes animales'.A4])-ROW(['Formes animales'.$A$1]);0) -> 3 | C4: 1 | D4: 1 | E4: 3 | F4: 2 | G4: 3 | H4: 3 | I4: 1 | J4: 1 | K4: 3
A5: CaractÃ©ristiques | B5: of:=""&HLOOKUP(['Formes animales'.$B$1];['Formes animales'.$C$2:.$AA$99];ROW(['Formes animales'.A5])-ROW(['Formes animales'.$A$1]);0) -> 
A6: Force | B6: of:=""&HLOOKUP(['Formes animales'.$B$1];['Formes animales'.$C$2:.$AA$99];ROW(['Formes animales'.A6])-ROW(['Formes animales'.$A$1]);0) -> 16 | C6: 12 | D6: 8 | E6: 17 | F6: 8 | G6: 16 | H6: 19 | I6: 6 | J6: 10 | K6: 17
A7: DextÃ©ritÃ© | B7: of:=""&HLOOKUP(['Formes animales'.$B$1];['Formes animales'.$C$2:.$AA$99];ROW(['Formes animales'.A7])-ROW(['Formes animales'.$A$1]);0) -> 19 | C7: 17 | D7: 15 | E7: 17 | F7: 17 | G7: 19 | H7: 12 | I7: 17 | J7: 15 | K7: 15
A8: Constitution | B8: of:=""&HLOOKUP(['Formes animales'.$B$1];['Formes animales'.$C$2:.$AA$99];ROW(['Formes animales'.A8])-ROW(['Formes animales'.$A$1]);0) -> 15 | C8: 13 | D8: 17 | E8: 13 | F8: 11 | G8: 15 | H8: 17 | I8: 10 | J8: 12 | K8: 17
A9: Vitesse | B9: of:=""&HLOOKUP(['Formes animales'.$B$1];['Formes animales'.$C$2:.$AA$99];ROW(['Formes animales'.A9])-ROW(['Formes animales'.$A$1]);0) -> 
A10: Type | B10: of:=""&HLOOKUP(['Formes animales'.$B$1];['Formes animales'.$C$2:.$AA$99];ROW(['Formes animales'.A10])-ROW(['Formes animales'.$A$1]);0) -> - | C10: - | D10: Vol (marche 3m) | E10: Esc, et nage | F10: Esc, et nage | G10: - | H10: Nage (marche 6m) | I10: Vol (marche 3m) | J10: Vol (marche 3m) | K10: Marche ou nage
A11: MÃ¨tres | B11: of:=""&HLOOKUP(['Formes animales'.$B$1];['Formes animales'.$C$2:.$AA$99];ROW(['Formes animales'.A11])-ROW(['Formes animales'.$A$1]);0) -> 15 | C11: 12 | D11: of:=12*1.5 -> 18 | E11: 6 | F11: 6 | G11: 15 | H11: 9 | I11: 18 | J11: 24 | K11: 9
A12: CatÃ©gorie de taille | B12: of:=""&HLOOKUP(['Formes animales'.$B$1];['Formes animales'.$C$2:.$AA$99];ROW(['Formes animales'.A12])-ROW(['Formes animales'.$A$1]);0) -> M | C12: P | D12: P | E12: M | F12: M | G12: M | H12: M | I12: TP | J12: P | K12: M
A13: CA Naturelle | B13: of:=""&HLOOKUP(['Formes animales'.$B$1];['Formes animales'.$C$2:.$AA$99];ROW(['Formes animales'.A13])-ROW(['Formes animales'.$A$1]);0) -> 1 | C13: 1 | D13: 2 | E13: 2 | F13: 3 | G13: 1 | H13: 4 | I13: 2 | J13: 1 | K13: 3
A14: CompÃ©tences | B14: of:=""&HLOOKUP(['Formes animales'.$B$1];['Formes animales'.$C$2:.$AA$99];ROW(['Formes animales'.A14])-ROW(['Formes animales'.$A$1]);0) -> 
A15: Acrobaties | B15: of:=""&HLOOKUP(['Formes animales'.$B$1];['Formes animales'.$C$2:.$AA$99];ROW(['Formes animales'.A15])-ROW(['Formes animales'.$A$1]);0) -> 0 | C15: 0 | D15: 0 | E15: 0 | F15: 0 | G15: 0 | H15: 0 | I15: 0 | J15: 0 | K15: 0 | L15: 0 | M15: 0 | N15: 0 | O15: 0 | P15: 0 | Q15: 0 | R15: 0 | S15: 0 | T15: 0 | U15: 0
A16: Art de la magie | B16: of:=""&HLOOKUP(['Formes animales'.$B$1];['Formes animales'.$C$2:.$AA$99];ROW(['Formes animales'.A16])-ROW(['Formes animales'.$A$1]);0) -> 0 | C16: 0 | D16: 0 | E16: 0 | F16: 0 | G16: 0 | H16: 0 | I16: 0 | J16: 0 | K16: 0 | L16: 0 | M16: 0 | N16: 0 | O16: 0 | P16: 0 | Q16: 0 | R16: 0 | S16: 0 | T16: 0 | U16: 0
A17: Artisanat (...) | B17: of:=""&HLOOKUP(['Formes animales'.$B$1];['Formes animales'.$C$2:.$AA$99];ROW(['Formes animales'.A17])-ROW(['Formes animales'.$A$1]);0) -> 0 | C17: 0 | D17: 0 | E17: 0 | F17: 0 | G17: 0 | H17: 0 | I17: 0 | J17: 0 | K17: 0 | L17: 0 | M17: 0 | N17: 0 | O17: 0 | P17: 0 | Q17: 0 | R17: 0 | S17: 0 | T17: 0 | U17: 0
A18: Bluff | B18: of:=""&HLOOKUP(['Formes animales'.$B$1];['Formes animales'.$C$2:.$AA$99];ROW(['Formes animales'.A18])-ROW(['Formes animales'.$A$1]);0) -> 0 | C18: 0 | D18: 0 | E18: 0 | F18: 0 | G18: 0 | H18: 0 | I18: 0 | J18: 0 | K18: 0 | L18: 0 | M18: 0 | N18: 0 | O18: 0 | P18: 0 | Q18: 0 | R18: 0 | S18: 0 | T18: 0 | U18: 0
A19: Concentration | B19: of:=""&HLOOKUP(['Formes animales'.$B$1];['Formes animales'.$C$2:.$AA$99];ROW(['Formes animales'.A19])-ROW(['Formes animales'.$A$1]);0) -> 0 | C19: 0 | D19: 0 | E19: 0 | F19: 0 | G19: 0 | H19: 0 | I19: 0 | J19: 0 | K19: 0 | L19: 0 | M19: 0 | N19: 0 | O19: 0 | P19: 0 | Q19: 0 | R19: 0 | S19: 0 | T19: 0 | U19: 0
A20: Connaissances (archit./ingÃ©nÃ©rie) | B20: of:=""&HLOOKUP(['Formes animales'.$B$1];['Formes animales'.$C$2:.$AA$99];ROW(['Formes animales'.A20])-ROW(['Formes animales'.$A$1]);0) -> 0 | C20: 0 | D20: 0 | E20: 0 | F20: 0 | G20: 0 | H20: 0 | I20: 0 | J20: 0 | K20: 0 | L20: 0 | M20: 0 | N20: 0 | O20: 0 | P20: 0 | Q20: 0 | R20: 0 | S20: 0 | T20: 0 | U20: 0
A21: Connaissances (explo. souterraine) | B21: of:=""&HLOOKUP(['Formes animales'.$B$1];['Formes animales'.$C$2:.$AA$99];ROW(['Formes animales'.A21])-ROW(['Formes animales'.$A$1]);0) -> 0 | C21: 0 | D21: 0 | E21: 0 | F21: 0 | G21: 0 | H21: 0 | I21: 0 | J21: 0 | K21: 0 | L21: 0 | M21: 0 | N21: 0 | O21: 0 | P21: 0 | Q21: 0 | R21: 0 | S21: 0 | T21: 0 | U21: 0
A22: Connaissances (folklore local) | B22: of:=""&HLOOKUP(['Formes animales'.$B$1];['Formes animales'.$C$2:.$AA$99];ROW(['Formes animales'.A22])-ROW(['Formes animales'.$A$1]);0) -> 0 | C22: 0 | D22: 0 | E22: 0 | F22: 0 | G22: 0 | H22: 0 | I22: 0 | J22: 0 | K22: 0 | L22: 0 | M22: 0 | N22: 0 | O22: 0 | P22: 0 | Q22: 0 | R22: 0 | S22: 0 | T22: 0 | U22: 0
A23: Connaissances (gÃ©ographie) | B23: of:=""&HLOOKUP(['Formes animales'.$B$1];['Formes animales'.$C$2:.$AA$99];ROW(['Formes animales'.A23])-ROW(['Formes animales'.$A$1]);0) -> 0 | C23: 0 | D23: 0 | E23: 0 | F23: 0 | G23: 0 | H23: 0 | I23: 0 | J23: 0 | K23: 0 | L23: 0 | M23: 0 | N23: 0 | O23: 0 | P23: 0 | Q23: 0 | R23: 0 | S23: 0 | T23: 0 | U23: 0
A24: Connaissances (histoire) | B24: of:=""&HLOOKUP(['Formes animales'.$B$1];['Formes animales'.$C$2:.$AA$99];ROW(['Formes animales'.A24])-ROW(['Formes animales'.$A$1]);0) -> 0 | C24: 0 | D24: 0 | E24: 0 | F24: 0 | G24: 0 | H24: 0 | I24: 0 | J24: 0 | K24: 0 | L24: 0 | M24: 0 | N24: 0 | O24: 0 | P24: 0 | Q24: 0 | R24: 0 | S24: 0 | T24: 0 | U24: 0
A25: Connaissances (mystÃ¨res) | B25: of:=""&HLOOKUP(['Formes animales'.$B$1];['Formes animales'.$C$2:.$AA$99];ROW(['Formes animales'.A25])-ROW(['Formes animales'.$A$1]);0) -> 0 | C25: 0 | D25: 0 | E25: 0 | F25: 0 | G25: 0 | H25: 0 | I25: 0 | J25: 0 | K25: 0 | L25: 0 | M25: 0 | N25: 0 | O25: 0 | P25: 0 | Q25: 0 | R25: 0 | S25: 0 | T25: 0 | U25: 0
A26: Connaissances (nature) | B26: of:=""&HLOOKUP(['Formes animales'.$B$1];['Formes animales'.$C$2:.$AA$99];ROW(['Formes animales'.A26])-ROW(['Formes animales'.$A$1]);0) -> 0 | C26: 0 | D26: 0 | E26: 0 | F26: 0 | G26: 0 | H26: 0 | I26: 0 | J26: 0 | K26: 0 | L26: 0 | M26: 0 | N26: 0 | O26: 0 | P26: 0 | Q26: 0 | R26: 0 | S26: 0 | T26: 0 | U26: 0
A27: Connaissances (noblesse et royautÃ©) | B27: of:=""&HLOOKUP(['Formes animales'.$B$1];['Formes animales'.$C$2:.$AA$99];ROW(['Formes animales'.A27])-ROW(['Formes animales'.$A$1]);0) -> 0 | C27: 0 | D27: 0 | E27: 0 | F27: 0 | G27: 0 | H27: 0 | I27: 0 | J27: 0 | K27: 0 | L27: 0 | M27: 0 | N27: 0 | O27: 0 | P27: 0 | Q27: 0 | R27: 0 | S27: 0 | T27: 0 | U27: 0
A28: Connaissances (plans) | B28: of:=""&HLOOKUP(['Formes animales'.$B$1];['Formes animales'.$C$2:.$AA$99];ROW(['Formes animales'.A28])-ROW(['Formes animales'.$A$1]);0) -> 0 | C28: 0 | D28: 0 | E28: 0 | F28: 0 | G28: 0 | H28: 0 | I28: 0 | J28: 0 | K28: 0 | L28: 0 | M28: 0 | N28: 0 | O28: 0 | P28: 0 | Q28: 0 | R28: 0 | S28: 0 | T28: 0 | U28: 0
A29: Connaissances (religion) | B29: of:=""&HLOOKUP(['Formes animales'.$B$1];['Formes animales'.$C$2:.$AA$99];ROW(['Formes animales'.A29])-ROW(['Formes animales'.$A$1]);0) -> 0 | C29: 0 | D29: 0 | E29: 0 | F29: 0 | G29: 0 | H29: 0 | I29: 0 | J29: 0 | K29: 0 | L29: 0 | M29: 0 | N29: 0 | O29: 0 | P29: 0 | Q29: 0 | R29: 0 | S29: 0 | T29: 0 | U29: 0
A30: ContrefaÃ§on | B30: of:=""&HLOOKUP(['Formes animales'.$B$1];['Formes animales'.$C$2:.$AA$99];ROW(['Formes animales'.A30])-ROW(['Formes animales'.$A$1]);0) -> 0 | C30: 0 | D30: 0 | E30: 0 | F30: 0 | G30: 0 | H30: 0 | I30: 0 | J30: 0 | K30: 0 | L30: 0 | M30: 0 | N30: 0 | O30: 0 | P30: 0 | Q30: 0 | R30: 0 | S30: 0 | T30: 0 | U30: 0
A31: Crochetage | B31: of:=""&HLOOKUP(['Formes animales'.$B$1];['Formes animales'.$C$2:.$AA$99];ROW(['Formes animales'.A31])-ROW(['Formes animales'.$A$1]);0) -> 0 | C31: 0 | D31: 0 | E31: 0 | F31: 0 | G31: 0 | H31: 0 | I31: 0 | J31: 0 | K31: 0 | L31: 0 | M31: 0 | N31: 0 | O31: 0 | P31: 0 | Q31: 0 | R31: 0 | S31: 0 | T31: 0 | U31: 0
A32: DÃ©cryptage | B32: of:=""&HLOOKUP(['Formes animales'.$B$1];['Formes animales'.$C$2:.$AA$99];ROW(['Formes animales'.A32])-ROW(['Formes animales'.$A$1]);0) -> 0 | C32: 0 | D32: 0 | E32: 0 | F32: 0 | G32: 0 | H32: 0 | I32: 0 | J32: 0 | K32: 0 | L32: 0 | M32: 0 | N32: 0 | O32: 0 | P32: 0 | Q32: 0 | R32: 0 | S32: 0 | T32: 0 | U32: 0
A33: DÃ©guisement | B33: of:=""&HLOOKUP(['Formes animales'.$B$1];['Formes animales'.$C$2:.$AA$99];ROW(['Formes animales'.A33])-ROW(['Formes animales'.$A$1]);0) -> 0 | C33: 0 | D33: 0 | E33: 0 | F33: 0 | G33: 0 | H33: 0 | I33: 0 | J33: 0 | K33: 0 | L33: 0 | M33: 0 | N33: 0 | O33: 0 | P33: 0 | Q33: 0 | R33: 0 | S33: 0 | T33: 0 | U33: 0
A34: DÃ©placement silencieux | B34: of:=""&HLOOKUP(['Formes animales'.$B$1];['Formes animales'.$C$2:.$AA$99];ROW(['Formes animales'.A34])-ROW(['Formes animales'.$A$1]);0) -> 0 | C34: 4 | D34: 0 | E34: 0 | F34: 0 | G34: 0 | H34: 0 | I34: 0 | J34: 0 | K34: 4 | L34: 0 | M34: 0 | N34: 0 | O34: 0 | P34: 0 | Q34: 0 | R34: 0 | S34: 0 | T34: 0 | U34: 0
A35: DÃ©samorÃ§age/sabotage | B35: of:=""&HLOOKUP(['Formes animales'.$B$1];['Formes animales'.$C$2:.$AA$99];ROW(['Formes animales'.A35])-ROW(['Formes animales'.$A$1]);0) -> 0 | C35: 0 | D35: 0 | E35: 0 | F35: 0 | G35: 0 | H35: 0 | I35: 0 | J35: 0 | K35: 0 | L35: 0 | M35: 0 | N35: 0 | O35: 0 | P35: 0 | Q35: 0 | R35: 0 | S35: 0 | T35: 0 | U35: 0
A36: DÃ©tection | B36: of:=""&HLOOKUP(['Formes animales'.$B$1];['Formes animales'.$C$2:.$AA$99];ROW(['Formes animales'.A36])-ROW(['Formes animales'.$A$1]);0) -> 0 | C36: 0 | D36: 4 | E36: 4 | F36: 4 | G36: 0 | H36: 0 | I36: 8 | J36: 8 | K36: 0 | L36: 0 | M36: 0 | N36: 0 | O36: 0 | P36: 0 | Q36: 0 | R36: 0 | S36: 0 | T36: 0 | U36: 0
A37: Diplomatie | B37: of:=""&HLOOKUP(['Formes animales'.$B$1];['Formes animales'.$C$2:.$AA$99];ROW(['Formes animales'.A37])-ROW(['Formes animales'.$A$1]);0) -> 0 | C37: 0 | D37: 0 | E37: 0 | F37: 0 | G37: 0 | H37: 0 | I37: 0 | J37: 0 | K37: 0 | L37: 0 | M37: 0 | N37: 0 | O37: 0 | P37: 0 | Q37: 0 | R37: 0 | S37: 0 | T37: 0 | U37: 0
A38: DiscrÃ©tion | B38: of:=""&HLOOKUP(['Formes animales'.$B$1];['Formes animales'.$C$2:.$AA$99];ROW(['Formes animales'.A38])-ROW(['Formes animales'.$A$1]);0) -> 0 | C38: 4 | D38: 0 | E38: 4 | F38: 4 | G38: 0 | H38: 0 | I38: 0 | J38: 0 | K38: 4 | L38: 0 | M38: 0 | N38: 0 | O38: 0 | P38: 0 | Q38: 0 | R38: 0 | S38: 0 | T38: 0 | U38: 0
A39: Dressage | B39: of:=""&HLOOKUP(['Formes animales'.$B$1];['Formes animales'.$C$2:.$AA$99];ROW(['Formes animales'.A39])-ROW(['Formes animales'.$A$1]);0) -> 0 | C39: 0 | D39: 0 | E39: 0 | F39: 0 | G39: 0 | H39: 0 | I39: 0 | J39: 0 | K39: 0 | L39: 0 | M39: 0 | N39: 0 | O39: 0 | P39: 0 | Q39: 0 | R39: 0 | S39: 0 | T39: 0 | U39: 0
A40: Equilibre | B40: of:=""&HLOOKUP(['Formes animales'.$B$1];['Formes animales'.$C$2:.$AA$99];ROW(['Formes animales'.A40])-ROW(['Formes animales'.$A$1]);0) -> 0 | C40: 4 | D40: 0 | E40: 8 | F40: 8 | G40: 0 | H40: 0 | I40: 0 | J40: 0 | K40: 0 | L40: 0 | M40: 0 | N40: 0 | O40: 0 | P40: 0 | Q40: 0 | R40: 0 | S40: 0 | T40: 0 | U40: 0
A41: Equitation | B41: of:=""&HLOOKUP(['Formes animales'.$B$1];['Formes animales'.$C$2:.$AA$99];ROW(['Formes animales'.A41])-ROW(['Formes animales'.$A$1]);0) -> 0 | C41: 0 | D41: 0 | E41: 0 | F41: 0 | G41: 0 | H41: 0 | I41: 0 | J41: 0 | K41: 0 | L41: 0 | M41: 0 | N41: 0 | O41: 0 | P41: 0 | Q41: 0 | R41: 0 | S41: 0 | T41: 0 | U41: 0
A42: Escalade | B42: of:=""&HLOOKUP(['Formes animales'.$B$1];['Formes animales'.$C$2:.$AA$99];ROW(['Formes animales'.A42])-ROW(['Formes animales'.$A$1]);0) -> 0 | C42: 4 | D42: 0 | E42: of:=MAX(DEX;FOR)-FOR+8 -> 9 | F42: of:=MAX(DEX;FOR)-FOR+8 -> 9 | G42: 0 | H42: 0 | I42: 0 | J42: 0 | K42: 0 | L42: 0 | M42: 0 | N42: 0 | O42: 0 | P42: 0 | Q42: 0 | R42: 0 | S42: 0 | T42: 0 | U42: 0
A43: Escamotage | B43: of:=""&HLOOKUP(['Formes animales'.$B$1];['Formes animales'.$C$2:.$AA$99];ROW(['Formes animales'.A43])-ROW(['Formes animales'.$A$1]);0) -> 0 | C43: 0 | D43: 0 | E43: 0 | F43: 0 | G43: 0 | H43: 0 | I43: 0 | J43: 0 | K43: 0 | L43: 0 | M43: 0 | N43: 0 | O43: 0 | P43: 0 | Q43: 0 | R43: 0 | S43: 0 | T43: 0 | U43: 0
A44: Estimation | B44: of:=""&HLOOKUP(['Formes animales'.$B$1];['Formes animales'.$C$2:.$AA$99];ROW(['Formes animales'.A44])-ROW(['Formes animales'.$A$1]);0) -> 0 | C44: 0 | D44: 0 | E44: 0 | F44: 0 | G44: 0 | H44: 0 | I44: 0 | J44: 0 | K44: 0 | L44: 0 | M44: 0 | N44: 0 | O44: 0 | P44: 0 | Q44: 0 | R44: 0 | S44: 0 | T44: 0 | U44: 0
A45: Evasion | B45: of:=""&HLOOKUP(['Formes animales'.$B$1];['Formes animales'.$C$2:.$AA$99];ROW(['Formes animales'.A45])-ROW(['Formes animales'.$A$1]);0) -> 0 | C45: 0 | D45: 0 | E45: 0 | F45: 0 | G45: 0 | H45: 0 | I45: 0 | J45: 0 | K45: 0 | L45: 0 | M45: 0 | N45: 0 | O45: 0 | P45: 0 | Q45: 0 | R45: 0 | S45: 0 | T45: 0 | U45: 0
A46: Fouille | B46: of:=""&HLOOKUP(['Formes animales'.$B$1];['Formes animales'.$C$2:.$AA$99];ROW(['Formes animales'.A46])-ROW(['Formes animales'.$A$1]);0) -> 0 | C46: 0 | D46: 0 | E46: 0 | F46: 0 | G46: 0 | H46: 0 | I46: 0 | J46: 0 | K46: 0 | L46: 0 | M46: 0 | N46: 0 | O46: 0 | P46: 0 | Q46: 0 | R46: 0 | S46: 0 | T46: 0 | U46: 0
A47: Intimidation | B47: of:=""&HLOOKUP(['Formes animales'.$B$1];['Formes animales'.$C$2:.$AA$99];ROW(['Formes animales'.A47])-ROW(['Formes animales'.$A$1]);0) -> 0 | C47: 0 | D47: 0 | E47: 0 | F47: 0 | G47: 0 | H47: 0 | I47: 0 | J47: 0 | K47: 0 | L47: 0 | M47: 0 | N47: 0 | O47: 0 | P47: 0 | Q47: 0 | R47: 0 | S47: 0 | T47: 0 | U47: 0
A48: Langue | B48: of:=""&HLOOKUP(['Formes animales'.$B$1];['Formes animales'.$C$2:.$AA$99];ROW(['Formes animales'.A48])-ROW(['Formes animales'.$A$1]);0) -> 0 | C48: 0 | D48: 0 | E48: 0 | F48: 0 | G48: 0 | H48: 0 | I48: 0 | J48: 0 | K48: 0 | L48: 0 | M48: 0 | N48: 0 | O48: 0 | P48: 0 | Q48: 0 | R48: 0 | S48: 0 | T48: 0 | U48: 0
A49: MaÃ®trise des cordes | B49: of:=""&HLOOKUP(['Formes animales'.$B$1];['Formes animales'.$C$2:.$AA$99];ROW(['Formes animales'.A49])-ROW(['Formes animales'.$A$1]);0) -> 0 | C49: 0 | D49: 0 | E49: 0 | F49: 0 | G49: 0 | H49: 0 | I49: 0 | J49: 0 | K49: 0 | L49: 0 | M49: 0 | N49: 0 | O49: 0 | P49: 0 | Q49: 0 | R49: 0 | S49: 0 | T49: 0 | U49: 0
A50: Natation | B50: of:=""&HLOOKUP(['Formes animales'.$B$1];['Formes animales'.$C$2:.$AA$99];ROW(['Formes animales'.A50])-ROW(['Formes animales'.$A$1]);0) -> 0 | C50: 0 | D50: 0 | E50: 0 | F50: 0 | G50: 0 | H50: 0 | I50: 0 | J50: 0 | K50: 0 | L50: 0 | M50: 0 | N50: 0 | O50: 0 | P50: 0 | Q50: 0 | R50: 0 | S50: 0 | T50: 0 | U50: 0
A51: Perception auditive | B51: of:=""&HLOOKUP(['Formes animales'.$B$1];['Formes animales'.$C$2:.$AA$99];ROW(['Formes animales'.A51])-ROW(['Formes animales'.$A$1]);0) -> 0 | C51: 8 | D51: 0 | E51: 4 | F51: 4 | G51: 0 | H51: 0 | I51: 0 | J51: 0 | K51: 0 | L51: 0 | M51: 0 | N51: 0 | O51: 0 | P51: 0 | Q51: 0 | R51: 0 | S51: 0 | T51: 0 | U51: 0
A52: Premiers secours | B52: of:=""&HLOOKUP(['Formes animales'.$B$1];['Formes animales'.$C$2:.$AA$99];ROW(['Formes animales'.A52])-ROW(['Formes animales'.$A$1]);0) -> 0 | C52: 0 | D52: 0 | E52: 0 | F52: 0 | G52: 0 | H52: 0 | I52: 0 | J52: 0 | K52: 0 | L52: 0 | M52: 0 | N52: 0 | O52: 0 | P52: 0 | Q52: 0 | R52: 0 | S52: 0 | T52: 0 | U52: 0
A53: Profession (â¦) | B53: of:=""&HLOOKUP(['Formes animales'.$B$1];['Formes animales'.$C$2:.$AA$99];ROW(['Formes animales'.A53])-ROW(['Formes animales'.$A$1]);0) -> 0 | C53: 0 | D53: 0 | E53: 0 | F53: 0 | G53: 0 | H53: 0 | I53: 0 | J53: 0 | K53: 0 | L53: 0 | M53: 0 | N53: 0 | O53: 0 | P53: 0 | Q53: 0 | R53: 0 | S53: 0 | T53: 0 | U53: 0
A54: Psychologie | B54: of:=""&HLOOKUP(['Formes animales'.$B$1];['Formes animales'.$C$2:.$AA$99];ROW(['Formes animales'.A54])-ROW(['Formes animales'.$A$1]);0) -> 0 | C54: 0 | D54: 0 | E54: 0 | F54: 0 | G54: 0 | H54: 0 | I54: 0 | J54: 0 | K54: 0 | L54: 0 | M54: 0 | N54: 0 | O54: 0 | P54: 0 | Q54: 0 | R54: 0 | S54: 0 | T54: 0 | U54: 0
A55: Renseignements | B55: of:=""&HLOOKUP(['Formes animales'.$B$1];['Formes animales'.$C$2:.$AA$99];ROW(['Formes animales'.A55])-ROW(['Formes animales'.$A$1]);0) -> 0 | C55: 0 | D55: 0 | E55: 0 | F55: 0 | G55: 0 | H55: 0 | I55: 0 | J55: 0 | K55: 0 | L55: 0 | M55: 0 | N55: 0 | O55: 0 | P55: 0 | Q55: 0 | R55: 0 | S55: 0 | T55: 0 | U55: 0
A56: ReprÃ©sentation (â¦) | B56: of:=""&HLOOKUP(['Formes animales'.$B$1];['Formes animales'.$C$2:.$AA$99];ROW(['Formes animales'.A56])-ROW(['Formes animales'.$A$1]);0) -> 0 | C56: 0 | D56: 0 | E56: 0 | F56: 0 | G56: 0 | H56: 0 | I56: 0 | J56: 0 | K56: 0 | L56: 0 | M56: 0 | N56: 0 | O56: 0 | P56: 0 | Q56: 0 | R56: 0 | S56: 0 | T56: 0 | U56: 0
A57: Saut | B57: of:=""&HLOOKUP(['Formes animales'.$B$1];['Formes animales'.$C$2:.$AA$99];ROW(['Formes animales'.A57])-ROW(['Formes animales'.$A$1]);0) -> 0 | C57: of:=DEX-FOR+8 -> 9 | D57: 0 | E57: 0 | F57: 0 | G57: 0 | H57: 0 | I57: 0 | J57: 0 | K57: 0 | L57: 0 | M57: 0 | N57: 0 | O57: 0 | P57: 0 | Q57: 0 | R57: 0 | S57: 0 | T57: 0 | U57: 0
A58: Survie | B58: of:=""&HLOOKUP(['Formes animales'.$B$1];['Formes animales'.$C$2:.$AA$99];ROW(['Formes animales'.A58])-ROW(['Formes animales'.$A$1]);0) -> 0 | C58: 0 | D58: 4 | E58: 0 | F58: 0 | G58: 0 | H58: 0 | I58: 0 | J58: 0 | K58: 0 | L58: 0 | M58: 0 | N58: 0 | O58: 0 | P58: 0 | Q58: 0 | R58: 0 | S58: 0 | T58: 0 | U58: 0
A59: Utilisation d'objets magiques | B59: of:=""&HLOOKUP(['Formes animales'.$B$1];['Formes animales'.$C$2:.$AA$99];ROW(['Formes animales'.A59])-ROW(['Formes animales'.$A$1]);0) -> 0 | C59: 0 | D59: 0 | E59: 0 | F59: 0 | G59: 0 | H59: 0 | I59: 0 | J59: 0 | K59: 0 | L59: 0 | M59: 0 | N59: 0 | O59: 0 | P59: 0 | Q59: 0 | R59: 0 | S59: 0 | T59: 0 | U59: 0
A60: ParticularitÃ©s | B60: of:=""&HLOOKUP(['Formes animales'.$B$1];['Formes animales'.$C$2:.$AA$99];ROW(['Formes animales'.A60])-ROW(['Formes animales'.$A$1]);0) -> 
B61: of:=""&HLOOKUP(['Formes animales'.$B$1];['Formes animales'.$C$2:.$AA$99];ROW(['Formes animales'.A61])-ROW(['Formes animales'.$A$1]);0) -> Morsure (1D6) | C61: Griffe 1D3 | D61: Bec (1D4) | E61: Morsure (1D3) | F61: Morsure (1D4) | G61: Morsure (1D6) | H61: Morsure (1D8) ou Queue (1D12) | I61: Serres (1D4) | J61: Serres (1D4) | K61: Morsure (1D8)
B62: of:=""&HLOOKUP(['Formes animales'.$B$1];['Formes animales'.$C$2:.$AA$99];ROW(['Formes animales'.A62])-ROW(['Formes animales'.$A$1]);0) -> 2 Griffes (1D2, Ã  Att-5) | C62: Outrance : 2 Griffes, Morsure (1D4, Ã Att-5) | E62: Constriction | F62: Venin (DD11, 1D6/1D6 Con) | G62: 2 Griffes (1D2, Ã Att-5) | H62: Etreinte | J62: Outrance : 2 Serres et Bec (1D4, Att-5) | K62: Peut faire 10 aux jets de Nage si en danger et bonus de +8
B63: of:=""&HLOOKUP(['Formes animales'.$B$1];['Formes animales'.$C$2:.$AA$99];ROW(['Formes animales'.A63])-ROW(['Formes animales'.$A$1]);0) -> Croc en jambe (+3) | C63: 2 Pattes arriÃ¨res (1D3) | E63: Etreinte | F63: Peut faire 10 aux jets d'Escalade | G63: Croc en jambe (+3) | H63: Peut faire 10 aux jets de Nage si en danger et bonus de +8 | K63: +2 DiscrÃ©tion dans la vÃ©gÃ©tation Ã©paisse
B64: of:=""&HLOOKUP(['Formes animales'.$B$1];['Formes animales'.$C$2:.$AA$99];ROW(['Formes animales'.A64])-ROW(['Formes animales'.$A$1]);0) ->  | C64: Science de la lutte | E64: Peut faire 10 aux jets d'Escalade | F64: Peut faire 10 aux jets de Nage si en danger et bonus de +9 | H64: +4 DiscrÃ©tion dans l'eau
B65: of:=""&HLOOKUP(['Formes animales'.$B$1];['Formes animales'.$C$2:.$AA$99];ROW(['Formes animales'.A65])-ROW(['Formes animales'.$A$1]);0) ->  | C65: Bond (outrance + pattes arriÃ¨res en charge) | E65: Peut faire 10 aux jets de Nage si en danger et bonus de +8 | F65: Peut courir en nageant | H65: Monte Ã +10 en ne laissant dÃ©passer que les narines et les yeux
B66: of:=""&HLOOKUP(['Formes animales'.$B$1];['Formes animales'.$C$2:.$AA$99];ROW(['Formes animales'.A66])-ROW(['Formes animales'.$A$1]);0) ->  | C66: +2 DiscrÃ©tion dans la brousse | E66: Peut courir en nageant
B67: of:=""&HLOOKUP(['Formes animales'.$B$1];['Formes animales'.$C$2:.$AA$99];ROW(['Formes animales'.A67])-ROW(['Formes animales'.$A$1]);0) -> 
B68: of:=""&HLOOKUP(['Formes animales'.$B$1];['Formes animales'.$C$2:.$AA$99];ROW(['Formes animales'.A68])-ROW(['Formes animales'.$A$1]);0) -> 
B69: of:=""&HLOOKUP(['Formes animales'.$B$1];['Formes animales'.$C$2:.$AA$99];ROW(['Formes animales'.A69])-ROW(['Formes animales'.$A$1]);0) -> 
B70: of:=""&HLOOKUP(['Formes animales'.$B$1];['Formes animales'.$C$2:.$AA$99];ROW(['Formes animales'.A70])-ROW(['Formes animales'.$A$1]);0) -> 
B71: of:=""&HLOOKUP(['Formes animales'.$B$1];['Formes animales'.$C$2:.$AA$99];ROW(['Formes animales'.A71])-ROW(['Formes animales'.$A$1]);0) -> 
B72: of:=""&HLOOKUP(['Formes animales'.$B$1];['Formes animales'.$C$2:.$AA$99];ROW(['Formes animales'.A72])-ROW(['Formes animales'.$A$1]);0) -> 
B73: of:=""&HLOOKUP(['Formes animales'.$B$1];['Formes animales'.$C$2:.$AA$99];ROW(['Formes animales'.A73])-ROW(['Formes animales'.$A$1]);0) -> 
B74: of:=""&HLOOKUP(['Formes animales'.$B$1];['Formes animales'.$C$2:.$AA$99];ROW(['Formes animales'.A74])-ROW(['Formes animales'.$A$1]);0) -> 
B75: of:=""&HLOOKUP(['Formes animales'.$B$1];['Formes animales'.$C$2:.$AA$99];ROW(['Formes animales'.A75])-ROW(['Formes animales'.$A$1]);0) -> 
B76: of:=""&HLOOKUP(['Formes animales'.$B$1];['Formes animales'.$C$2:.$AA$99];ROW(['Formes animales'.A76])-ROW(['Formes animales'.$A$1]);0) -> 
B77: of:=""&HLOOKUP(['Formes animales'.$B$1];['Formes animales'.$C$2:.$AA$99];ROW(['Formes animales'.A77])-ROW(['Formes animales'.$A$1]);0) -> 
B78: of:=""&HLOOKUP(['Formes animales'.$B$1];['Formes animales'.$C$2:.$AA$99];ROW(['Formes animales'.A78])-ROW(['Formes animales'.$A$1]);0) -> 
B79: of:=""&HLOOKUP(['Formes animales'.$B$1];['Formes animales'.$C$2:.$AA$99];ROW(['Formes animales'.A79])-ROW(['Formes animales'.$A$1]);0) -> 
B80: of:=""&HLOOKUP(['Formes animales'.$B$1];['Formes animales'.$C$2:.$AA$99];ROW(['Formes animales'.A80])-ROW(['Formes animales'.$A$1]);0) -> 
B81: of:=""&HLOOKUP(['Formes animales'.$B$1];['Formes animales'.$C$2:.$AA$99];ROW(['Formes animales'.A81])-ROW(['Formes animales'.$A$1]);0) -> 
B82: of:=""&HLOOKUP(['Formes animales'.$B$1];['Formes animales'.$C$2:.$AA$99];ROW(['Formes animales'.A82])-ROW(['Formes animales'.$A$1]);0) -> 
B83: of:=""&HLOOKUP(['Formes animales'.$B$1];['Formes animales'.$C$2:.$AA$99];ROW(['Formes animales'.A83])-ROW(['Formes animales'.$A$1]);0) -> 
B84: of:=""&HLOOKUP(['Formes animales'.$B$1];['Formes animales'.$C$2:.$AA$99];ROW(['Formes animales'.A84])-ROW(['Formes animales'.$A$1]);0) -> 

Sheet: Compagnon animal
A1: Nom
A2: Race | B2: Serval (chacal)
A3: Type | B3: CrÃ©ature magique
A4: DÃ©placement | B4: 8 cases
A5: Taille | B5: of:=IF(CROISSANCE;"G";"P") -> P
A6: Bonus de taille | B6: of:=IF(['Compagnon animal'.$B$5]="P";1;0)+IF(['Compagnon animal'.$B$5]="TP";2;0)+IF(['Compagnon animal'.$B$5]="Min";3;0)+IF(['Compagnon animal'.$B$5]="I";4;0)+IF(['Compagnon animal'.$B$5]="G";-1;0)+IF(['Compagnon animal'.$B$5]="TG";-2;0)+IF(['Compagnon animal'.$B$5]="Gig";-3;0)+IF(['Compagnon animal'.$B$5]="C";-4;0) -> 1
A8: DV | B8: of:=1+(TR_DRUI*2-2) -> 7 | C8: D8
A9: PV | B9: of:=ROUNDDOWN(['Compagnon animal'.B8]*4.5;0)+['Compagnon animal'.B8]*['Compagnon animal'.C26] -> 38
A11: BBA | B11: of:=ROUNDDOWN(['Compagnon animal'.B8]*3/4;0) -> 5
A12: Lutte | B12: of:=['Compagnon animal'.B11]+['Compagnon animal'.C24]-4*['Compagnon animal'.E19] -> 3
A13: Init | B13: of:=['Compagnon animal'.C25] -> 5
A15: Niveaux de Druide | B15: of:=NIV_CLASSE1+3 -> 9 | C15: Croissance animale (de P Ã G) | E15: of:=FALSE() -> 0 | F15: Donne Ã©galement une RD(10/magie)
A16: Tranche de Druide | B16: of:=IF(['Compagnon animal'.B15]>8;4;IF(['Compagnon animal'.B15]>5;3;IF(['Compagnon animal'.B15]>2;2;IF(['Compagnon animal'.B15]>0;1;0)))) -> 4
A18: Arme | B18: Attaque | C18: DÃ© | D18: DÃ©gÃ¢ts | E18: Taille | F18: Divers | G18: Malus
A19: Griffe | B19: of:=['Compagnon animal'.B11]+['Compagnon animal'.C25]+['Compagnon animal'.E19]+SUM(['Compagnon animal'.F19:.G19]) -> 11 | C19: 1D3 | D19: of:=['Compagnon animal'.C24] -> 2 | E19: of:=['Compagnon animal'.B6] -> 1 | F19: 0 | G19: 0 | H19: Une attaque simple est composÃ©e d'une griffe
A20: Morsure | B20: of:=['Compagnon animal'.B11]+['Compagnon animal'.C25]+['Compagnon animal'.E20]+SUM(['Compagnon animal'.F20:.G20])-IF(TR_DRUI>3;2;5) -> 9 | C20: 1D4 | D20: of:=ROUNDDOWN(['Compagnon animal'.C24]/2;0) -> 1 | E20: of:=['Compagnon animal'.B6] -> 1 | F20: 0 | G20: 0 | H20: Une attaque Ã outrance de base est composÃ©e de 2 griffes et 1 morsure
A21: Pattes arriÃ¨res | B21: of:=['Compagnon animal'.B11]+['Compagnon animal'.C25]+['Compagnon animal'.E21]+SUM(['Compagnon animal'.F21:.G21]) -> 11 | C21: 1D3 | D21: of:=ROUNDDOWN(['Compagnon animal'.C24]/2;0) -> 1 | E21: of:=['Compagnon animal'.B6] -> 1 | F21: 0 | G21: 0
A23: CaractÃ©ristique | B23: Total | C23: Modificateur | D23: Base | E23: Bonus Druide | F23: Autres
A24: Force | B24: of:=SUM(['Compagnon animal'.D24:.F24])+IF(CROISSANCE;8;0) -> 15 | C24: of:=IF((['Compagnon animal'.B24]-10)/2>0;ROUNDDOWN((['Compagnon animal'.B24]-10)/2;0);ROUNDUP((['Compagnon animal'.B24]-10)/2;0)) -> 2 | D24: 12 | E24: of:=TR_DRUI-1 -> 3
A25: DextÃ©ritÃ© | B25: of:=SUM(['Compagnon animal'.D25:.F25])-IF(CROISSANCE;2;0) -> 20 | C25: of:=IF((['Compagnon animal'.B25]-10)/2>0;ROUNDDOWN((['Compagnon animal'.B25]-10)/2;0);ROUNDUP((['Compagnon animal'.B25]-10)/2;0)) -> 5 | D25: 17 | E25: of:=TR_DRUI-1 -> 3 | H25: 1 point de carac
A26: Constitution | B26: of:=SUM(['Compagnon animal'.D26:.F26])+IF(CROISSANCE;4;0) -> 13 | C26: of:=IF((['Compagnon animal'.B26]-10)/2>0;ROUNDDOWN((['Compagnon animal'.B26]-10)/2;0);ROUNDUP((['Compagnon animal'.B26]-10)/2;0)) -> 1 | D26: 13 | E26: - | H26: 6 points de comp
A27: Intelligence | B27: of:=SUM(['Compagnon animal'.D27:.F27]) -> 2 | C27: of:=IF((['Compagnon animal'.B27]-10)/2>0;ROUNDDOWN((['Compagnon animal'.B27]-10)/2;0);ROUNDUP((['Compagnon animal'.B27]-10)/2;0)) -> -4 | D27: 2 | E27: - | H27: 2 dons --> habitant du dÃ©sert ? http://www.gemmaline.com/dons/dons-habitant-du-desert-695.htm
A28: Sagesse | B28: of:=SUM(['Compagnon animal'.D28:.F28]) -> 12 | C28: of:=IF((['Compagnon animal'.B28]-10)/2>0;ROUNDDOWN((['Compagnon animal'.B28]-10)/2;0);ROUNDUP((['Compagnon animal'.B28]-10)/2;0)) -> 1 | D28: 12 | E28: - | H28: 4 tours
A29: Charisme | B29: of:=SUM(['Compagnon animal'.D29:.F29]) -> 7 | C29: of:=IF((['Compagnon animal'.B29]-10)/2>0;ROUNDDOWN((['Compagnon animal'.B29]-10)/2;0);ROUNDUP((['Compagnon animal'.B29]-10)/2;0)) -> -2 | D29: 7 | E29: -
B31: Total | C31: Base | D31: CaractÃ©ristique | E31: Divers | F31: Malus
A32: RÃ©flexes | B32: of:=SUM(['Compagnon animal'.C32:.F32])+IF(CROISSANCE;4;0) -> 10 | C32: of:=ROUNDDOWN(['Compagnon animal'.B8]/2+2;0) -> 5 | D32: of:=['Compagnon animal'.C25] -> 5
A33: Vigueur | B33: of:=SUM(['Compagnon animal'.C33:.F33])+IF(CROISSANCE;4;0) -> 6 | C33: of:=ROUNDDOWN(['Compagnon animal'.B8]/2+2;0) -> 5 | D33: of:=['Compagnon animal'.C26] -> 1
A34: VolontÃ© | B34: of:=SUM(['Compagnon animal'.C34:.F34])+IF(CROISSANCE;4;0) -> 3 | C34: of:=ROUNDDOWN(['Compagnon animal'.B8]/3;0) -> 2 | D34: of:=['Compagnon animal'.C28] -> 1
B36: Total | C36: Base | D36: DextÃ©ritÃ© | E36: Naturelle | F36: Taille | G36: Armure | H36: Divers | I36: Malus
A37: CA | B37: of:=SUM(['Compagnon animal'.C37:.I37]) -> 23 | C37: of:=10 -> 10 | D37: of:=['Compagnon animal'.C25] -> 5 | E37: of:=1+TR_DRUI*2-2+IF(CROISSANCE;2;0) -> 7 | F37: of:=['Compagnon animal'.B6] -> 1 | G37: 0 | H37: 0 | I37: 0
A38: Contact | B38: of:=['Compagnon animal'.C37]+['Compagnon animal'.D37]+['Compagnon animal'.F37]+['Compagnon animal'.H37]+['Compagnon animal'.I37] -> 16
A39: Pris au dÃ©pourvu | B39: of:=['Compagnon animal'.C37]+['Compagnon animal'.E37]+['Compagnon animal'.F37]+['Compagnon animal'.G37]+['Compagnon animal'.H37]+['Compagnon animal'.I37]+IF(['Compagnon animal'.D37]<0;['Compagnon animal'.D37];0) -> 18
A41: CompÃ©tences | B41: Total | C41: Base | D41: Carac | E41: Racial | F41: Bonus | G41: Taille
A42: DÃ©tection | B42: of:=SUM(['Compagnon animal'.C42:.G42]) -> 3 | C42: 2 | D42: of:=['Compagnon animal'.C28] -> 1 | E42: 0
A43: DÃ©placement silencieux | B43: of:=SUM(['Compagnon animal'.C43:.G43]) -> 9 | C43: 0 | D43: of:=['Compagnon animal'.C25] -> 5 | E43: 4
A44: DiscrÃ©tion | B44: of:=SUM(['Compagnon animal'.C44:.G44]) -> 13 | C44: 0 | D44: of:=['Compagnon animal'.C25] -> 5 | E44: 4 | G44: 4 | H44: +2 dans la brousse
A45: Equilibre | B45: of:=SUM(['Compagnon animal'.C45:.G45]) -> 9 | C45: 0 | D45: of:=['Compagnon animal'.C25] -> 5 | E45: 4
A46: Escalade | B46: of:=SUM(['Compagnon animal'.C46:.G46]) -> 8 | C46: 2 | D46: of:=['Compagnon animal'.C24] -> 2 | E46: 4
A47: Perception auditive | B47: of:=SUM(['Compagnon animal'.C47:.G47]) -> 9 | C47: 0 | D47: of:=['Compagnon animal'.C28] -> 1 | E47: 8
A48: Saut | B48: of:=SUM(['Compagnon animal'.C48:.G48])+['Compagnon animal'.I48] -> 17 | C48: 0 | D48: of:=['Compagnon animal'.C25] -> 5 | E48: 8 | H48: Bonus vitesse | I48: 4
B49: Somme | C49: of:=SUM(['Compagnon animal'.C42:.C48]) -> 4 | D49: Maximum | E49: of:=['Compagnon animal'.B8]+3 -> 10
B50: Calcul auto | C50: of:=(['Compagnon animal'.B8]+3)*IF(2+['Compagnon animal'.C27]>1;2+['Compagnon animal'.C27];1) -> 10
A52: Dons
A53: Attaque en finesse | B53: DV 1 | C53: Peut utiliser sa DextÃ©ritÃ© pour toucher Ã la place de sa Force
A54: Etreinte | B54: Racial | C54: Peut engager une lutte sur action libre, sans attaque d'opportunitÃ© aprÃ¨s une morsure rÃ©ussie. Peut ensuite utiliser ses pattes arriÃ¨res
A55: Bond | B55: Racial | C55: Peut faire une attaque Ã outrance lors d'une charge (dont 2 Pattes arriÃ¨res).
A56: Pattes arriÃ¨res | B56: Racial | C56: 1D3 dommages
A57: Saut agile | B57: Racial | C57: Utilise sa DextÃ©ritÃ© plutÃ´t que sa force pour les jets de Saut
A58: Bonus raciaux | B58: Racial | C58: +4 Equilibre, Escalade, DiscrÃ©tion DÃ©placement silencieux (bonus monte Ã +8 dans les hautes herbes), +8 en Saut et Perception auditive
B59: DV 3
B60: DV 6
A62: SpÃ©cial
A63: Odorat
A64: Vision nocturne
A66: Pouvoirs Druide
A67: of:=IF(TR_DRUI>0;"Lien";"-") -> Lien | B67: Dirige le compagnon sur action libre, le pousse sur actin simple, +4 de circonstances pour les jets d'empathie sauvage et Dressage vs son compagnon
A68: of:=IF(TR_DRUI>0;"Transfert d'effet magique";"-") -> Transfert d'effet magique | B68: Permet d'affecter Ã©galement le compagnon avec un sort
A69: of:=IF(TR_DRUI>1;"Esquive totale";"-") -> Esquive totale | B69: Annule les dommages si le JDS de RÃ©flexes est rÃ©ussi (au lieu de les diviser par deux)
A70: of:=IF(TR_DRUI>2;"DÃ©votion";"-") -> DÃ©votion | B70: +4 de moral aux JDS vs les sorts et effets de l'Ã©cole de l'enchantement
A71: of:=IF(TR_DRUI>3;"Attaques multiples";"-") -> Attaques multiples | B71: RÃ©duit le malus des attaques secondaires ou en fournit une
A75: Tours
A81: Tours bonus | B81: of:=TR_DRUI -> 4

Sheet: Sorts
B1: Disponible | C1: PrÃ©parÃ© | D1: UtilisÃ© | E1: DD
A2: Niveau 0 | B2: of:=[$Personnage.B51] -> 6 | C2: of:=SUM([Sorts.C3:.C11]) -> 6 | D2: of:=SUM([Sorts.D3:.D11]) -> 0 | E2: of:=10+MAGIE -> 16 | G2: druide | H2: http://www.regles-donjons-dragons.com/Page45.html
A3: Assistance divine | B3: of:=[Sorts.C3]-[Sorts.D3] -> 1 | C3: 1 | G3: seigneur des marÃ©es | H3: http://dndtools.pw/classes/lord-of-tides/
A4: RepÃ©rage | B4: of:=[Sorts.C4]-[Sorts.D4] -> 1 | C4: 1 | G4: sort druide | H4: http://www.regles-donjons-dragons.com/Page461.html#Topic775
A5: DÃ©tection du poison | B5: of:=[Sorts.C5]-[Sorts.D5] -> 2 | C5: 2
A6: DÃ©tection de la magie | B6: of:=[Sorts.C6]-[Sorts.D6] -> 1 | C6: 1
A7: Lecture de la magie | B7: of:=[Sorts.C7]-[Sorts.D7] -> 1 | C7: 1
B8: of:=[Sorts.C8]-[Sorts.D8] -> 0 | G8: aide | H8: http://www.regles-donjons-dragons.com/Page543.html#Topic1137
A9: Illumination | B9: of:=[Sorts.C9]-[Sorts.D9] -> 0 | G9: appaisement des Ã©motions | H9: http://www.regles-donjons-dragons.com/Page561.html#Topic689
B10: of:=[Sorts.C10]-[Sorts.D10] -> 0 | G10: soin modÃ©rÃ© | H10: http://www.regles-donjons-dragons.com/Page1084.html#Topic362
B11: of:=[Sorts.C11]-[Sorts.D11] -> 0 | G11: restoration partielle | H11: http://www.regles-donjons-dragons.com/Page1053.html#Topic819
G12: dÃ©livrance de la paralysie | H12: http://www.regles-donjons-dragons.com/Page722.html#Topic1104
A13: Niveau 1 | B13: of:=[$Personnage.B52] -> 7 | C13: of:=SUM([Sorts.C14:.C21]) -> 7 | D13: of:=SUM([Sorts.D14:.D21]) -> 0 | E13: of:=11+MAGIE -> 17
A14: Lueur fÃ©erique | B14: of:=[Sorts.C14]-[Sorts.D14] -> 1 | C14: 1
A15: Passage sans traces | B15: of:=[Sorts.C15]-[Sorts.D15] -> 2 | C15: 2
A16: Grand pas | B16: of:=[Sorts.C16]-[Sorts.D16] -> 1 | C16: 1
A17: Saut | B17: of:=[Sorts.C17]-[Sorts.D17] -> 1 | C17: 1
A18: Soins lÃ©gers (1d8+5) | B18: of:=[Sorts.C18]-[Sorts.D18] -> 2 | C18: 2
B19: of:=[Sorts.C19]-[Sorts.D19] -> 0
B20: of:=[Sorts.C20]-[Sorts.D20] -> 0
B21: of:=[Sorts.C21]-[Sorts.D21] -> 0
B22: of:=[Sorts.C22]-[Sorts.D22] -> 0
A24: Niveau 2 | B24: of:=[$Personnage.B53] -> 7 | C24: of:=SUM([Sorts.C25:.C32]) -> 7 | D24: of:=SUM([Sorts.D25:.D32]) -> 0 | E24: of:=12+MAGIE -> 18
A25: Endurance de lâours (+4con) | B25: of:=[Sorts.C25]-[Sorts.D25] -> 1 | C25: 1
A26: Force de taureau (+4 for) | B26: of:=[Sorts.C26]-[Sorts.D26] -> 1 | C26: 1
A27: GrÃ¢ce fÃ©line (7+4dex) | B27: of:=[Sorts.C27]-[Sorts.D27] -> 1 | C27: 1
A28: NuÃ©e grouillante | B28: of:=[Sorts.C28]-[Sorts.D28] -> 1 | C28: 1
A29: Peau dâÃ©corce (+5 armure) | B29: of:=[Sorts.C29]-[Sorts.D29] -> 1 | C29: 1
A30: RÃ©sistance aux Ã©nergies destructives | B30: of:=[Sorts.C30]-[Sorts.D30] -> 1 | C30: 1
A31: Sagesse du hibou (7+4sag) | B31: of:=[Sorts.C31]-[Sorts.D31] -> 1 | C31: 1
A32: lame de feu | B32: of:=[Sorts.C32]-[Sorts.D32] -> 0 | H32: http://www.regles-donjons-dragons.com/Page871.html
B33: of:=[Sorts.C33]-[Sorts.D33] -> 0
A35: Niveau 3 | B35: of:=[$Personnage.B54] -> 6 | C35: of:=SUM([Sorts.C36:.C43]) -> 6 | D35: of:=SUM([Sorts.D36:.D43]) -> 0 | E35: of:=13+MAGIE -> 19
A36: Soins modÃ©rÃ©s (2d8+10) | B36: of:=[Sorts.C36]-[Sorts.D36] -> 2 | C36: 2
A37: Domination dâanimal | B37: of:=[Sorts.C37]-[Sorts.D37] -> 0 | C37: 0
A38: GuÃ©rison des maladies | B38: of:=[Sorts.C38]-[Sorts.D38] -> 1 | C38: 1
A39: Fusion dans la pierre | B39: of:=[Sorts.C39]-[Sorts.D39] -> 1 | C39: 1
A40: Neutralisation du poison | B40: of:=[Sorts.C40]-[Sorts.D40] -> 1 | C40: 1
A41: Mur de vent | B41: of:=[Sorts.C41]-[Sorts.D41] -> 1 | C41: 1
B42: of:=[Sorts.C42]-[Sorts.D42] -> 0
B43: of:=[Sorts.C43]-[Sorts.D43] -> 0
B44: of:=[Sorts.C44]-[Sorts.D44] -> 0
A46: Niveau 4 | B46: of:=[$Personnage.B55] -> 4 | C46: of:=SUM([Sorts.C47:.C54]) -> 4 | D46: of:=SUM([Sorts.D47:.D54]) -> 0 | E46: of:=14+MAGIE -> 20
A47: Colonne de feu (12d6 dmg) | B47: of:=[Sorts.C47]-[Sorts.D47] -> 1 | C47: 1
A48: Soins important (3d8+13) | B48: of:=[Sorts.C48]-[Sorts.D48] -> 1 | C48: 1
A49: Dissipation de la magie | B49: of:=[Sorts.C49]-[Sorts.D49] -> 1 | C49: 1
A50: LibertÃ© de mouvement | B50: of:=[Sorts.C50]-[Sorts.D50] -> 1 | C50: 1
B51: of:=[Sorts.C51]-[Sorts.D51] -> 0
B52: of:=[Sorts.C52]-[Sorts.D52] -> 0
B53: of:=[Sorts.C53]-[Sorts.D53] -> 0
B54: of:=[Sorts.C54]-[Sorts.D54] -> 0
B55: of:=[Sorts.C55]-[Sorts.D55] -> 0
A57: Niveau 5 | B57: of:=[$Personnage.B56] -> 4 | C57: of:=SUM([Sorts.C58:.C65]) -> 4 | D57: of:=SUM([Sorts.D58:.D65]) -> 1 | E57: of:=15+MAGIE -> 21
A58: Protection contre la mort | B58: of:=[Sorts.C58]-[Sorts.D58] -> 0 | C58: 0
A59: Appel de la tempÃªte | B59: of:=[Sorts.C59]-[Sorts.D59] -> 0 | C59: 1 | D59: 1
A60: Peau de pierre | B60: of:=[Sorts.C60]-[Sorts.D60] -> 1 | C60: 1
A61: Soins intensifs (4d8+12) | B61: of:=[Sorts.C61]-[Sorts.D61] -> 1 | C61: 1
B62: of:=[Sorts.C62]-[Sorts.D62] -> 0
A63: Communion avec la nature (repÃ©rage) | B63: of:=[Sorts.C63]-[Sorts.D63] -> 1 | C63: 1
A64: Croissance animale | B64: of:=[Sorts.C64]-[Sorts.D64] -> 0
A65: MÃ©tamorphose funeste | B65: of:=[Sorts.C65]-[Sorts.D65] -> 0
B66: of:=[Sorts.C66]-[Sorts.D66] -> 0
A68: Niveau 6 | B68: of:=[$Personnage.B57] -> 3 | C68: of:=SUM([Sorts.C69:.C76]) -> 3 | D68: of:=SUM([Sorts.D69:.D76]) -> 1 | E68: of:=16+MAGIE -> 22
A69: Orientation | B69: 1
A70: Mur de pierre | B70: 1
A71: Soins lÃ©gers de groupe (1d8+13) | B71: of:=[Sorts.C71]-[Sorts.D71] -> 0 | C71: 1 | D71: 1
A72: Endurance de lâours de groupe (+4con) | B72: of:=[Sorts.C72]-[Sorts.D72] -> 1 | C72: 1
B73: of:=[Sorts.C73]-[Sorts.D73] -> 0
B74: of:=[Sorts.C74]-[Sorts.D74] -> 0
A75: Pierres commÃ¨res | B75: 1 | C75: 1
B76: of:=[Sorts.C76]-[Sorts.D76] -> 0
B77: of:=[Sorts.C77]-[Sorts.D77] -> 0
A79: Niveau 7 | B79: of:=[$Personnage.B58] -> 0 | C79: of:=SUM([Sorts.C80:.C87]) -> 0 | D79: of:=SUM([Sorts.D80:.D87]) -> 0 | E79: of:=17+MAGIE -> 23
B80: of:=[Sorts.C80]-[Sorts.D80] -> 0
B81: of:=[Sorts.C81]-[Sorts.D81] -> 0
B82: of:=[Sorts.C82]-[Sorts.D82] -> 0
B83: of:=[Sorts.C83]-[Sorts.D83] -> 0
B84: of:=[Sorts.C84]-[Sorts.D84] -> 0
B85: of:=[Sorts.C85]-[Sorts.D85] -> 0
B86: of:=[Sorts.C86]-[Sorts.D86] -> 0
B87: of:=[Sorts.C87]-[Sorts.D87] -> 0
B88: of:=[Sorts.C88]-[Sorts.D88] -> 0
A90: Niveau 8 | B90: of:=[$Personnage.B59] -> 0 | C90: of:=SUM([Sorts.C91:.C98]) -> 0 | D90: of:=SUM([Sorts.D91:.D98]) -> 0 | E90: of:=18+MAGIE -> 24
B91: of:=[Sorts.C91]-[Sorts.D91] -> 0
B92: of:=[Sorts.C92]-[Sorts.D92] -> 0
B93: of:=[Sorts.C93]-[Sorts.D93] -> 0
B94: of:=[Sorts.C94]-[Sorts.D94] -> 0
B95: of:=[Sorts.C95]-[Sorts.D95] -> 0
B96: of:=[Sorts.C96]-[Sorts.D96] -> 0
B97: of:=[Sorts.C97]-[Sorts.D97] -> 0
B98: of:=[Sorts.C98]-[Sorts.D98] -> 0
B99: of:=[Sorts.C99]-[Sorts.D99] -> 0
A101: Niveau 9 | B101: of:=[$Personnage.B60] -> 0 | C101: of:=SUM([Sorts.C102:.C109]) -> 0 | D101: of:=SUM([Sorts.D102:.D109]) -> 0 | E101: of:=19+MAGIE -> 25
B102: of:=[Sorts.C102]-[Sorts.D102] -> 0
B103: of:=[Sorts.C103]-[Sorts.D103] -> 0
B104: of:=[Sorts.C104]-[Sorts.D104] -> 0
B105: of:=[Sorts.C105]-[Sorts.D105] -> 0
B106: of:=[Sorts.C106]-[Sorts.D106] -> 0
B107: of:=[Sorts.C107]-[Sorts.D107] -> 0
B108: of:=[Sorts.C108]-[Sorts.D108] -> 0
B109: of:=[Sorts.C109]-[Sorts.D109] -> 0
B110: of:=[Sorts.C110]-[Sorts.D110] -> 0

Sheet: Ref
A1: Force | B1: LÃ©gÃ¨re | C1: IntermÃ©diaire | D1: Lourde
A2: 1 | B2: 1.5 | C2: 3 | D2: 5
A3: 2 | B3: 3 | C3: 6.5 | D3: 10
A4: 3 | B4: 5 | C4: 10 | D4: 15
A5: 4 | B5: 6.5 | C5: 13 | D5: 20
A6: 5 | B6: 8 | C6: 16.5 | D6: 25
A7: 6 | B7: 10 | C7: 20 | D7: 30
A8: 7 | B8: 11.5 | C8: 23 | D8: 35
A9: 8 | B9: 13 | C9: 26.5 | D9: 40
A10: 9 | B10: 15 | C10: 30 | D10: 45
A11: 10 | B11: 17.5 | C11: 33 | D11: 50
A12: 11 | B12: 19 | C12: 38 | D12: 57.5
A13: 12 | B13: 21.5 | C13: 43 | D13: 65
A14: 13 | B14: 25 | C14: 50 | D14: 75
A15: 14 | B15: 29 | C15: 58 | D15: 87.5
A16: 15 | B16: 33 | C16: 66.5 | D16: 100
A17: 16 | B17: 38 | C17: 76.5 | D17: 115
A18: 17 | B18: 43 | C18: 86.5 | D18: 130
A19: 18 | B19: 50 | C19: 100 | D19: 150
A20: 19 | B20: 58 | C20: 116.5 | D20: 175
A21: 20 | B21: 66.5 | C21: 133 | D21: 200
A22: 21 | B22: 76.5 | C22: 153 | D22: 130
A23: 22 | B23: 86.5 | C23: 173 | D23: 260
A24: 23 | B24: 100 | C24: 200 | D24: 300
A25: 24 | B25: 116.5 | C25: 233 | D25: 350
A26: 25 | B26: 133 | C26: 266.5 | D26: 400
A27: 26 | B27: 153 | C27: 306.5 | D27: 460
A28: 27 | B28: 173 | C28: 346.5 | D28: 520
A29: 28 | B29: 200 | C29: 400 | D29: 600
A30: 29 | B30: 233 | C30: 466.5 | D30: 700